no,reg number,name of establishment,address,products
1,DL 10,"Workshop 2, Tho Quang Seafood Processing and Export Company","Da Nang Fisheries Service  Industrial Zone, Tho Quang Ward, Son Tra District, Da Nang City",Frozen
2,DL 46,Ha Tinh seaproducts import export share Company (HA TINH SEAPRODEX CO),"Thach Son Village, Thach Ha District, Ha Tinh Province",Frozen
3,DL 49,Quang Ninh Aquatic Products Export Joint Stock Company No 2 (Aquapexco),"Hamlet 7, Road 10, Quang Yen Town, Yen Hung District, Quang Ninh Province","Frozen, Dried"
4,DL 415,PHU MINH HUNG seafood joint stock company - PHUMINHHUNG JOSTOCO,"Road 10, Quang Yen Town, Yen Hung District, Quang Ninh Province",Frozen
5,DL 517,"QuangNinh Seafoods Processing And Exporting Company Limited (QUANGNINH SEAFOODS CO., LTD)","Zone 1, Hai Yen Ward, Mong Cai City, Quang Ninh Province",Frozen
6,HK 535,"THAO LINH 908 Limited Liability Company - THAO LINH 908 Co., Ltd","No.15, Minh Khai Street, Ha Lam Ward, Ha Long City, Quang Ninh Province",Dried
7,DL 536,IMPORT AND EXPORT SEAFOOD PROCESSING FACTORY - SON HAI MINH INVESTMENT ONE MEMBER COMPANY LIMITED (SOHAMICO).,"Dong Trung Hamlet, Dong Xa Commune, Van Don District, Quang Ninh Province",Frozen
8,DH 40,HaLong Canned Food Joint Stock Corporation - HALONG CANFOCO,"71 Le Lai Street, May Chai Ward, Ngo Quyen District, Hai Phong City",Canned
9,DL 42,Hai Phong Export Seaproducts processing Company  - SPC,"101 Ngo Quyen Street, Ngo Quyen District, Hai Phong City",Frozen
10,DL 73,Ha Long Service and Import Export  joint stock Company - HALONGSIMEXCO,"409 Le Lai Street, Ngo Quyen District, Hai Phong City",Frozen
11,DL 93,"Viet Truong Co., Ltd.","Vinh Niem Industrial Zone, Vinh Niem Ward, Le Chan District, Hai Phong City",Frozen
12,DL 168,SEAPRODEX HAIPHONG,"173 Ngo Quyen Street, May Chai Ward, Ngo Quyen District, Hai Phong City",Frozen
13,DL 74,Ha Long Fishery  Discovery Company - Ha Long FIDICOM	,"409 Le Lai Street, Ngo Quyen District, Hai Phong City",Frozen
14,DL 425,HaLong Factory for production of Cakes filled with seafood - HaLong service and import export joint stock company (HALONG SIMEXCO),"409 Le Lai Street, Ngo Quyen District, Hai Phong City",Frozen
15,DL 494,Trung Son Hung Yen Foodstuff Corporation - TRUNG SON CORP.,"Nhu Quynh Town, Van Lam District, Hung Yen Province",Frozen
16,DL 55,Branch of Ha Noi Seaproducts Import Export joint stock Corporation (SEAPRODEX HANOI) - Xuan Thuy Seaproducts  processing Factory,"Xuan Vinh Village, Xuan Truong District, Nam Dinh Province",Frozen
17,NM 507,"Trung Thanh Company Limited - Trung Thanh Co., Ltd","Lot D, Dong Van Industrial Zone, Duy Tien District, Ha Nam Province",Fish sauce
18,DL 429,"Viet Nam Rich Beauty Food company Limited (RB Co., LTD.)","Tan Son Fishing Port, Thai Thuy District, Thai Binh Province",Frozen
19,DL 47,Thanh Hoa fishery import - export joint stock company (HASUVIMEX),"Lot E, Le Mon Industrial Zone, Thanh Hoa City, Thanh Hoa Province",Frozen
20,DL 508,"LONG HAI TRADING -TRANSPORTATION-SEA PRODUCT - PROCESSING JOINT STOCK COMPANY (LONG HAI CO.,JSC)","Tien Phong Village, Hai Binh Commune, Tinh Gia District, Thanh Hoa Province",Frozen
21,NM 519,"Hoa Hai seaproducts processing company limited (HOA HAI Co., Ltd.)","Hoa Hai Hamlet, Hau Loc Commune, Hau Loc District, Thanh Hoa Province",Fish sauce
22,DL 247,"SEAPRODEXIM CO., NGHE AN II","Cau Giat Town, Quynh Luu District, Nghe An Province",Frozen
23,DL 45,South Ha Tinh Seaproduct  Import & Export Joint Stock company - SHATICO ,"Vung Ang Industrial Zone, Ky Anh District, Ha Tinh Province",Frozen
24,DL 171,Five stars Seafoods Joint Stock Company - FISSCO,"Thanh Trach Village, Bo Trach District , Quang Binh Province",Frozen
25,DL 336,Vinashin Quang Binh Trading and Tourism Limited Company,"National Road 1a, Phu Hai Precinct, Dong Hoi City, Quang Binh Province",Frozen
26,DL 41,Quang Ninh Seaproducts Import - Export Company,"35 Ben Tau Street, Ha Long City, Quang Ninh Province",Frozen
27,DL 12,Song Huong import export seafood company â SOSEAFOOD,"165 Nguyen Sinh Cung Street, Phu Thuong Ward, Phu Vang District,, Thua Thien Hue Province.",Frozen
28,DL 135,Hue Fisheries Development Joint-Stock Company - FIDECO,"No. 86, Nguyen Gia Thieu Street, Hue City, Thua Thien Hue Province",Frozen
29,DL 225,Seaproducts joint stock company of TT Hue - SEASPIMEX TT HUE,"Tan Cang, Thuan An Town, Phu Vang District, Thua Thien Hue Province",Frozen
30,DL 123,"HAI THANH CO., LTD.","Tho Quang Seaproducts Service  Industrial Zone, Tho Quang Ward, Son Tra District, Da Nang City",Frozen
31,DL 131,Thanh Khe Seafoods Factory - PROCIMEX Viet Nam Joint stock Company ,"C1 Block, Danang Aquatic Products Service & Industrial Zone, Tho Quang Ward, Son Tra District, Da Nang City",Frozen
32,DL 172,Da Nang processing Import - Export Trading Company ,"12/6 Duc Loi Street, Thuan Phuoc Ward, Hai Chau District, Da Nang City",Frozen
33,DL 32,Frozen Seafoods Factory No 32 - Thuan Phuoc seafoods and trading corporation,"Tho Quang Seafoods Industrial Processing Zone, Son Tra District, Da Nang City",Frozen
34,DL 190,Tho Quang Seafood processing and Export Company,"Da Nang Fisheries Service  Industrial Zone, Tho Quang Ward, Son Tra District, Da Nang City",Frozen
35,DL 164,D&N Foods processing (Danang) Company limited - DANIFOODS,"62 Yet Kieu Street, Tho Quang Precinct, Son Tra District, Da Nang City",Frozen
36,DL 170,Danang city Seaproducts Corporation - SEAFISH CORP.,"Nai Hung Block, Nai Hien Dong Precinct, Son Tra District, Da Nang City",Frozen
37,DL 419,Nhat Hoang seafood joint stock company,"Lot C4, Da Nang Fisheries Service  Industrial Zone, Tho Quang Ward, Son Tra District, Da Nang City",Frozen
38,DL 421,My Son Seafoods Factory - Thuan Phuoc seafoods and trading corporation,"Tho Quang Fisheries Service  Industrial Zone, Son Tra District, Da Nang City",Frozen
39,DL 506,SEAPRODEX DA NANG - SON TRA FOODSTUFF PROCESSING FACTORY,"Da Nang Fisheries Service  Industrial Zone, Tho Quang Ward, Son Tra District, Da Nang City",Frozen
40,HK 52,"HAI THANH CO., LTD.","Tho Quang Seaproducts Service  Industrial Zone, Tho Quang Ward, Son Tra District, Da Nang City",Dried
41,HK 94,"Phuoc Tien General Trading Company - Futco., Ltd.","358/11 Ngu Hanh Son Street, Ngu Hanh Son District, Da Nang City",Dried
42,HK 122,"Hai Vy production and trading company limited - HAVYCO., LTD","Thach Nham Hamlet, Hoa Nhon Village, Hoa Vang District, Da Nang City",Dried
43,DL 108,"Factory III - Dong Phuong company limited - DONG PHUONG Co., Ltd.","Lot 3, Dien Nam - Dien Ngoc Industrial Zone, Dien Ban District, Quang Nam Province",Frozen
44,DL 399,"Vinashin Fishin Company., Ltd (VINASHIN)","Lot 01, Tam Hiep Industrial Zone, Nui Thanh District, Quang Nam Province",Frozen
45,HK 91,Quang Nam Marine Products Export Import Joint Stock Company - Quang Nam Co,"580 Cua Dai Street, Hoi An Town, Quang Nam Province",Dried
46,HK 63,"TRUNG HAI FISHERIES CO., LTD. - MIOFISH","Tam Hiep Industrial Zone, Nui Thanh District, Quang Nam Province",Dried
47,DL 428,"Dong Phuong company limited - Dong Phuong Co., LTD.","Lot 3, Dien Nam-dien Ngoc Industrial Zone, Dien Ban District, Quang Nam Province",Frozen
48,DL 474,ASIA FOOD PROCESSING COMPANY LTD (AFC),"K943 National Road Ia, Dien Thang Commune, Dien Ban District, Quang Nam Province",Frozen
49,HK 442,"Dong An Co., Ltd.","Cam An Ward, Hoi An Town, Quang Nam Province",Dried
50,HK 475,"SEO NAM COMPANY LIMITED (SEO NAM Co., LTD).","Van Ly Industrial Zone, Dien Quang Commune, Dien Ban District, Quang Nam Province",Dried
51,DL 388,"OCEAN BLUE CO., LTD","Quang Phu Industrial Zone, Quang Ngai City, Quang Ngai Province",Frozen
52,DL 71,Quang Nam Marine Products Export Import Joint Stock Company - Quang Nam Co,"580 Cua Dai Street, Hoi An Town, Quang Nam Province",Frozen
53,DL 223,"ALPHASEA Co., Ltd.","Lot 7, Dien Nam - Dien Ngoc Industrial Zone, Dien Ban District, Quang Nam Province",Frozen
54,DL 169,"Dong Phuong Co., Ltd.","Lot 3, Dien Nam - Dien Ngoc Industrial Zone, Dien Ban District, Quang Nam Province",Frozen
55,DL 383,"DONG AN Co., Ltd.","Tan An Block, Cam An Ward, Hoi An Town, Quang Nam Province",Frozen
56,DL 510,Phunghung Private Enterprise - PhungHung. PTE.,"Lot 6, Quang Phu Industrial Zone, Quang Ngai City, Quang Ngai Province",Frozen
57,DL 531,"Hung Phong CO., LTD ","Lot 13, Quang Phu Industrial Zone, Quang Ngai City",Frozen
58,DL 602,"GALLANT OCEAN (QUANG NGAI).,LTD ","Quang Phu Industrial Zone, Quang Ngai City, Quang Ngai Province",Frozen
59,HK 604,PRIVATE ENTERPRISE BUSINESS HAI PHU,"Lot 12, Quang Phu Industrial Zone, Quang Ngai City, Quang Ngai Province",Dried
60,DL 16,SEAPRODEX - FACTORY 16	,"04 Phan Chu Trinh Street, Qui Nhon City, Binh Dinh Province",Frozen
61,DL 100,LAM SON Import - Export Foodstuff Joint stock company -        LAMSON FIMEXCO	,"Tay Son Street, Quang Trung Ward, Qui Nhon City, Binh Dinh Province",Frozen
62,DL 57,Binh Dinh Fishery Joint Stock Company - BIDIFISCO	,"2d Tran Hung Dao Street, Qui Nhon City, Binh Dinh Province",Frozen
63,DL 64,Greenisle Seafood and Vessel Engineering Joint Stock Company (Greenisle Sevesco)	,"06 Phan Chu Trinh Street, Quy Nhon City, Binh Dinh Province.",Frozen
64,HK 372,"Tan Phu Tai Seafood processing and trading company Limited - TPT seafood Co., Ltd.	","Group 2, Area 8, Bui Thi Xuan Ward, Qui Nhon City, Binh Dinh Province",Dried
65,DL 17,NHATRANG SEAPRODUCT COMPANY (NHATRANG SEAFOODS) - Nhatrang Seafoods - F. 17,58 B Hai Thang Tu Str. - Vinh Hai - Nha Trang City- Khã¡nh Hã²a Province,Frozen
66,DL 90,NHATRANG SEAPRODUCT COMPANY (NHATRANG SEAFOODS) - Nhatrang Seafoods - F. 90,01 Phuoc Long Str. - Binh Tan - Nha Trang City- Khã¡nh Hã²a Province,Frozen
67,DL 70,Cafico Vietnam Corporation,"9 Nguyen Trong Ky Street, Cam Ranh Town, Khanh Hoa Province.",Frozen
68,DL 140,VIET THANG PRIVATE LTD.,"Tan Dao Hamlet, Ninh Ich Commune, Ninh Hoa District, Khanh Hoa Province",Frozen
69,DL 245,Sea Association Factory,"Lot A4-a8, Suoi Dau Industrial Zone, Cam Lam District,  Khanh Hoa Province",Frozen
70,DL 315,"Sakura Food Co., Ltd.","28b Phuoc Long Street, Binh Tan Ward, Nha Trang City, Khanh Hoa Province",Frozen
71,DL 492,VIET THANG PRIVATE LTD.,"135 Nguyen Khuyen Street, Vinh Hai Ward, Nha Trang City, Khanh Hoa Province",Frozen
72,DH 246,United Resources Cannery,"Lot A4-a8, Suoi Dau Industrial Zone, Cam Lam District,  Khanh Hoa Province",Canned
73,HK 211,"Khai Thong Trading Co., Ltd.","580 Le Hong Phong Street, Nha Trang City, Khanh Hoa Province",Dried
74,DL 115,Nha Trang Fisco,"194 Le Hong Phong Treet, Nha Trang City, Khanh Hoa Province",Frozen
75,HK 212,"Camranh Seafoods Processing & Exporting Company Limited (CAMRANH SEAFOODS Co., Ltd) ","60 Nguyen Thai Hoc Street, Cam Loi Ward, Cam Ranh Town, Khã¡nh Hoa Province",Dried
76,DL 207,"Camranh Seafoods Processing & Exporting Company Limited (CAMRANH SEAFOODS Co., Ltd) ","National Road 1 A, Cam Thinh Dong, Cam Ranh Town, Khanh Hoa Province",Frozen
77,DL191,"KHANH HOA SEAFOODS EXPORTING COMPANY, LTD. (KHASPEXCO)","No. 10 Vo Thi Sau Street, Phuoc Long Ward, Nha Trang City, Khanh Hoa Province",Frozen
78,HK210,"KHANH HOA SEAFOODS EXPORTING COMPANY, LTD. (KHASPEXCO)","No. 50 Vo Thi Sau Street, Phuoc Long Ward, Nha Trang City, Khanh Hoa Province",Dried
79,DL 95,"Viet Long Co., Ltd.","2/7b Tan An Street, Binh Tan Ward, Nha Trang City, Khanh Hoa Province",Frozen
80,DH 203,Ha Long Canned Food Stock Corporation (HA LONG CANFOCO)-Canned Worshop 2,"6 Phuoc Long Street, Binh Tan Ward, Nha Trang City, Khanh Hoa Province",Canned
81,DL 153,"Factory 1 - TRUC AN Co., Ltd.","Lot A 12-13, Suoi Dau Industrial Zone, Cam Lam District,  Khanh Hoa Province",Frozen
82,DL 243,"GLOBAL SEA-PRODUCT CO.,LTD","17 Nguyen Trong Ky Street, Cam Linh Ward, Cam Ranh City, Khanh Hoa Province - Viet Nam",Frozen
83,DL 316,"Workshop 3, Long Shin Corporation (Long Shin Corp.)","Lot 4a, Suoi Dau Industrial Zone, Cam Lam District, Khanh Hoa Province",Frozen
84,HK 98,"Hoan My Co., Ltd.","45 Truong Son Street, Vinh Truong Ward, Nha Trang City, Khanh Hoa Province",Dried
85,DL 179,Bac Lieu Fisheries joint stock co - Branch Khanh Hoa,"Lot A9, Suoi Dau Industrial Zone, Dien Khanh District, Khanh Hoa Province",Frozen
86,DL 318,Hai Vuong Company Limited (HAVUCO),"Lot B, Road No.1, Suoi Dau Industrial Zone, Cam Lam District, Khanh Hoa Province",Frozen
87,DL 314,"Dragon Waves Frozen Food Factory Co., Ltd. (DRAGON WAVES)","Lot C3-c6, Suoi Dau Industrial Zone, Cam Lam District,  Khanh Hoa Province",Frozen
88,DL 361,"Workshop I & II, LONG SHIN CORPORATION","Lot B2-b3, Suoi Dau Industrial Zone, Cam Lam District,  Khanh Hoa Province",Frozen
89,DH 358,"Phillips Seafood (Viet Nam) Co., Ltd.","Lot B3-4 Suoi Dau Industrial Zone, Cam Lam District,  Khanh Hoa Province",Canned
90,HK 213,"Huy Quang Co., Ltd","Phuoc Thuong Hamlet, Phuoc Dong Village, Nha Trang City, Khanh Hoa Province",Dried
91,HK 112,Chin Tuy Private Enterprises Business,"69 Truong Son Street, Vinh Truong Ward, Nha Trang City, Khanh Hoa Province",Dried
92,HK 255,Dried seafood processing factory - Luong Son branch - TA SHUN CORPORATION (TASHUNCO),"Luong Hoa Hamlet, Vinh Luong Commune, Nha Trang City, Khanh Hoa Province",Dried
93,DL 448,Frozen seafood processing factory - Luong Son branch - TA SHUN CORPORATION (TASHUNCO),"Luong Hoa Hamlet, Vinh Luong Commune, Nha Trang City, Khanh Hoa Province",Frozen
94,DL 257,VN SEAFOOD COMPANY,"28b Phuoc Long Street, Nha Trang City, Khanh Hoa Province",Frozen
95,DL 373,"Factory 2, Truc An  Co., LTD.","Lot A1-14, Suoi Dau Industrial Zone, Cam Lam District,  Khanh Hoa Province",Frozen
96,DL 385,"Tin Thinh Co.,Ltd.","Lot F1, Suoi Dau Industrial Zone, Cam Lam District,  Khanh Hoa Province",Frozen
97,DL 394,NHATRANG SEAPRODUCT COMPANY (NHATRANG SEAFOODS) - Nhatrang Seafoods - F. 394,01 Phuoc Long Str. - Binh Tan - Nha Trang City- Khã¡nh Hã²a Province,Frozen
98,DL 526,"THINH HUNG CO., LTD","Lot F9-f10, Suoi Dau Industrial Zone, Cam Lam District, Khanh Hoa Province",Frozen
99,DL 605,"Quang Vinh Trading - Transportation one member Co., Ltd","Lot 47, Group 5, Vinh Thanh, Vinh Phuong Ward, Nha Trang City, Khã¡nh Hã²a Province",Frozen
100,DH 603,"KHANH HOA CANNED FOOD CO., LTD (KHACANFOOD)","1a Road, Cu Thanh Hamlet, Suoi Hiep Commune, Dien Khanh District, Khanh Hoa Province",Canned
101,HK 524,"BINH THEM Co., Ltd.","Hon Khoi Industrial Zone, Ninh Hai Commune, Ninh Hoa District, Khanh Hoa Province",Dried
102,HK 600,FUJIURA NHA TRANG LTD,"Plot F7+f8, Suoi Dau Industrial Zone, Cam Lam Village, Cam Ranh District, Khanh Hoa Province",Dried
103,HK 80,Ninh Thuan Agricultural products export company - NITAGREX,"158 Bac Ai Street, Do Vinh Ward, Phan Rang Thap Cham Town, Ninh Thuan Province",Dried
104,DL 601,"""Thong Thuan Seafood Co., Ltd Shrimp Processing Factory - No 1""","No. 104, Ngo Gia Tu Street, Phan Rang-thap  Cham City, Ninh Thuan Province",Frozen
105,HK 337,Trang Thuy private Enterprise (Trang Thuy seafood),"Lot A12, An Phu Industrial Zone, Tuy An District, Phu Yen Province",Dried
106,HK 214,Tae San Aqua - Product P&T Co.,"Lot B6, Hoa Hiep Industrial Zone, Tuy Hoa City, Phu Yen Province",Dried
107,HK 289,Viet Thai manufactural & commercial private business ,"Lot A5-15, An Phu Industrial Zone, Tuy Hoa District, Phu Yen Province",Dried
108,DL 198,"PHU YEN SEAFOODS CO., LTD","Lot A9-a11, Hoa Hiep Industrial Zone, Dong Hoa County, Phu Yen Province",Frozen
109,DL 481,"Ba Hai Co., Ltd.","Lot A13, An Phu Industrial Zone, Tuy Hoa City, Phu Yen Province",Frozen
110,DL 606,"Tae San Aqua - Products P&T Co., Ltd Factory two","Lot B6, Hoa Hiep Industrial Zone, Dong Hoa District, Phu Yen Province",Frozen
111,DL 125,"HAI NAM Co., LTD.","27 Nguyen Thong Street, Phu Hai Ward, Phan Thiet  City, Binhthuan Province",Frozen
112,HK 104,"SON TUYEN Co., LTD.","Hamlet 5, Ham Thang Village, Ham Thuan Bac District, Binh Thuan Province",Dried
113,HK 238,"Workshop No. 2, HAINAM Co., Ltd.","27 Nguyen Thong Street, Phu Hai Ward, Phan Thiet  City, Binhthuan Province",Dried
114,DL 192,"Hai Thuan export seaproduct processing Co., Ltd (Hai Thuan Co., LTD)","Lot No 8-9, Phan Thiet Fishing Port, Phan Thiet City, Binh Thuan Province",Frozen
115,DL 356,"Workshop No 3, HAI NAM Co., Ltd.","Lot 15, Phan Thiet Fishing Port, Phan Thiet City, Binh Thuan Province",Frozen
116,DL 467,"Hoang Nam Co., Ltd.","Quartier 10, Mui Ne Ward, Phan Thiet City, Binh Thuan Province",Frozen
117,DL 468,SEONGJIN VINA,"Lagi Fishing Port, Phuoc Loc Ward, Lagi Town, Binh Thuan Province",Frozen
118,HK 48,Phan Thiet Factory,"77 Vo Thi Sau Street, Hung Long Ward, Phan Thiet City, Binh Thuan Province",Dried
119,HK 393,"Hai Viet Seafood export Co., Ltd","A6 Gate No.2, Phan Thiet Fishing Port, Phan Thiet City, Binh Thuan Province",Dried
120,HK 485,"Hai Tien Trading Co., Ltd.","Lot A, Phan Thiet South Processing Seafood Zone, Phan Thiet City, Binh Thuan Province",Dried
121,HK 497,WORKSHOP DRIED MARINE PRODUCTS â PHU HAI SEAPRODUCTS FACTORY,"41 Nguyen Thong Street, Phan Thiet  City, Binh Thuan Province",Dried
122,DL 498,WORKSHOP FROZEN MARINE PRODUCTS â PHU HAI SEAPRODUCTS FACTORY,"Lot 16, Phan Thiet Fishing Port, Phan Thiet City, Binh Thuan Province",Frozen
123,DL 501,"PHU THUAN LIMITED COMPANY - PHU THUAN Co., LTD","Lien Huong Street, Binh Thanh Village, Tuy Phong District, Binh Thuan Province",Frozen
124,DL 728,"Hai Wang Seafood Co., Ltd","Lot 13 - 14, Phan Thiet Fishing Port, Phan Thiet City, Binh Thuan Province",Frozen
125,HK 522,"TUNG CHAU COMPANY LIMITED (TUNG CHAU Co., Ltd.)","Zone A, South Of Phan Thiet Fishing Port, Phan Thiet City, Binh Thuan Province",Dried
126,DL 38,"Nghe An Seaproducts Import-Export Joint Stock Company (Nghe An Seaprodexim, JSC)","Nghi Hai Ward, Cua Lo Town, Nghe An Province",Frozen
127,DL 11,Quang Binh Seaproducts Import - Export joint stock company - Quang Binh SEAFOOD,"8a Huong Giang Street, Dong Hoi City, Quang Binh Province",Frozen
128,DL 150,"Thanh An Co., Ltd.","No.12, Road 2, Song Than 1 Industrial Zone, Di An District, Binh Duong Province",Frozen; Salted
129,DH 149,Highland Dragon Enterprise,"No. 15, Road No.6, Song Than 1 Industrial Zone, Di An District, Binh Duong Province",Canned
130,DL 317,Seagift Company Ltd. (SEGICO),"7/9-binh Duc 2 Quarter, Binh Hoa Ward, Thuan An Town,  Binh Duong Province",Frozen
131,DL 319,United Seafood Packers Joint Stock Company (USPC),"Lot D1, Road 3, Dong An Industrial Zone, Thuan An District, Binh Duong Province",Frozen
132,DL 455,Highland Dragon Enterprise,"No.15, Road 6, Song Than I Industrial Zone, Di An District, Binh Duong Province",Frozen
133,DL 482,"Viet Trang Co., Ltd.","No.27, Song Than 2 Industrial Zone, Di An District, Binh Duong Province",Frozen
134,HK 233,"Hoa Nam Marine Agricultural Co., Ltd.","14/21a, Truong Son Street, Di An District, Binh Duong Province",Dried
135,TS 718,New Life Health Products Joint Stock Company (NEW LIFE),"Binh Giao Hamlet, Thuan Giao Commune,  Thuan An District, Binh Duong Province",Fish oil
136,DL 34,Export Seaproducts processing Enterprise I (F 34) -Baria Vungtau seafoods processing and import-export joint stock company - BASEAFOOD,"National Road 51a, Phuoc Trung Precinct, Ba Ria Town, Ba Ria Vung Tau Province",Frozen
137,DL 20,Export Seaproducts processing Enterprise II (F 20) -Baria Vungtau seafoods processing and import-export joint stock company - BASEAFOOD,"460 Truong Cong Dinh Street, Ward 8, Vung Tau City, Ba Ria Vung Tau Province",Frozen
138,DL 53,Phuoc Co Seafood Joint Stock Company (PCSE),"1738, 30/4 Street,  Ward 12, Vung Tau City, Ba Ria - Vung Tau Province",Frozen
139,DL 133,"VIFOODS Co., LTD - VIFOOD","Road No.7, Dong Xuyen Industrial Zone, Rach Dua Ward, Vung Tau City, Ba Ria Vung Tau Province",Frozen
140,DL 92,Hai Ha Private enterprise,"1752, 30/4 Street, Ward 12, Vung Tau City, Ba Ria Vung Tau Province",Frozen
141,DL 194,Hai Viet Corporation (HAVICO),"167/10 30/4 Street, Thanh Nhat Ward, Vung Tau City, Ba Ria Vung Tau Province",Frozen
142,DL 195,"Eastern Sea Co., Ltd. Brand ESC","1719a, 30/4 Street, Ward 12, Vung Tau City, Ba Ria Vung Tau Province",Frozen
143,DL 197,"Anh Nguyen Son Co., Ltd.","61a Phuoc Thang Street, Ward 12, Vung Tau City, Ba Ria Vung Tau Province",Frozen
144,DL 266,"Ngoc Tung Co., Ltd.","1589, 30/4 Street, Ward 12, Vung Tau City, Ba Ria Vung Tau Province",Frozen
145,DL 272,"ChangHua Viet Nam Seafood Co., Ltd.- VINACHANGHUA","1738, 30/4 Street, Ward 12, Vung Tau City, Ba Ria Vung Tau Province",Frozen
146,DL 302,"THU TRONG 1 SEA CO., LTD","My Xuan A Industrial Zone, Tan Thanh District, Ba Ria Vung Tau Province",Frozen
147,DL 286,"Seaproducts Processing Enterprise, ConDao Seaproducts and Import Export Joint Stock Company (COIMEX)","1738, 30/4 Street, Ward 12, Vung Tau City, Ba Ria Vung Tau  Province",Frozen
148,DL 267,Hai Long seafood joint stock company,"1752, 30/4 Street, Ward 12, Vung Tau City, Ba Ria Vung Tau Province",Frozen
149,DL 402,"Duong Ha Processing Trading  Seafood Company Limited  (DUONG HA CO., LTD)","1705, 30/4 Street, Ward 12, Vung Tau City, Ba Ria Vung Tau Province",Frozen
150,DL 413,"The Phu Co., LTD.","1743, 30/4 Street, Ward 12, Vung Tau City, Ba Ria Vung Tau Province",Frozen
151,DL 438,"CO MAY FOOD COMPANY LIMITED (CO MAY Co., LTD.)","No.63 30/4 Street, Thang Nhat Ward, Vung Tau City, Ba Ria Vung Tau Province",Frozen
152,DL 464,"TRONG DUC SEAFOOD., PTE","Lang Cat Hamlet, Tan Hai Village, Tan Thanh District, Ba Ria Vung Tau Province",Frozen
153,HK 235,MINH HAI PRIVATE,"Tam Phuoc Commune, Long Dien District, Ba Ria Vung Tau Province",Dried
154,DL 209,Value added seafood processing factory - Triseafood joint stock company (TRISEAFOOD JSC),"Lot 20a, Road No.8, Tan Tao Industrial Zone, Binh Tan District, Ho Chi Minh City",Frozen
155,DL 237,COFIDEC,"32/4 Le Van Khuong Street, Thoi An Ward, District 12, Ho Chi Minh City",Frozen
156,HK 156,Binh Thoi Seafood processing Enterprise - Sai Gon Aquatic products trading joint stock company,"Lot 4-6-8 Road Ia, Tan Tao Industrial Zone, Tan Tao A Ward, Binh Tan District, Ho Chi Minh City",Dried
157,HK 155,Cho Lon Seafood processing Enterprise (Cholifood) - Sai Gon Aquatic products trading joint stock company,"Lot 4-6-8 Road Ia, Tan Tao Industrial Zone, Tan Tao A Ward, Binh Tan District, Ho Chi Minh City",Dried
158,HK 222,Hoang Lai import-export joint stock company (Hoang Lai Im-Ex JSC),"04 Tong Van Tran Street, Ward 5, District 11, Ho Chi Minh City",Dried
159,NM 331,"MINH HA CO., LTD.","Lot C42b/1 Street 7, Vinh Loc Industrial Zone, Binh Chanh  District, Ho Chi Minh City",Fish sauce
160,HK 417,"Thien Tue Co., Ltd.","Road No.4, Tan Binh Industrial Zone, Tay Thanh Ward, Tan Phu District, Ho Chi Minh City",Dried
161,HK 444,"Cho Lon trading producing company limited (Cho Lon Co., LTD)","Hamlet 2a, Tan Thanh Tay Commune, Cu Chi District, Ho Chi Minh City",Dried
162,HK 454,"HUY SON CO., LTD.","63/4b, Tam Dong Hamlet, Thoi Tam Thon Commune, Hoc Mon District, Ho Chi Minh City",Dried
163,HK 715,"DONGTIEN CO., LTD","6, Do Van Day Street, Tan Hoa Hamlet, Tan Hiep Village, Hoc Mon District, Ho Chi Minh City.",Dried
164,NM 469,Lien Thanh seafood processing joint stock company,"595/37 Xo Viet Nghe Tinh Street, Ward 5, District 4, Ho Chi Minh City",Fish sauce
165,SG/001NL,Live seafood factory - HOANG HA international Logistics joint stock company,"Lot Iii-22, Road 19/5a, Tan Binh Industrial Zone, Tan Phu District, Ho Chi Minh City",Alive
166,SG/003NL,"TUONG HUU Co., LTD","Block 4, Street 3 No. 22b, Tan Binh Industrial Park, Tan Phu District, Ho Chi Minh City",Alive
167,79-001-DG,ROYAL LEE VIET NAM IMPORT EXPORT TRADING COMPANY LIMITED,"29/22/7 Nguyen Van Qua Street, Tan Hung Thuan Ward, District 12, Ho Chi Minh City",Alive
168,79-002-DG,"Anh Nhan Trading Production Co.,Ltd (ANPRO)","42/3e, Hamlet 4, Xuan Thoi Thuong Commune, Hoc Mon District, Ho Chi Minh City",Alive
169,79-003-NL,"Hai Thanh processing trading service seaproducts company limited (HT Processing trading Co., Ltd.)","29/22/7 Nguyen Van Qua Street, 6th Quarter, Tan Hung Thuan Ward, District 12, Ho Chi Minh City",Alive
170,79-004-NL,"Branch of south pacific fishery co., Ltd. (SOFIS Co., Ltd.)","47/9 Trinh Thi Mien Street, Thoi Tu Hamlet, Thoi Tam Thon Commune, Hoc Mon District, Ho Chi Minh City",Alive
171,DL 353,"TAN THANH LOI Frozen Food Co., Ltd.","546/1 Binh Cang 1 Small Village, Binh Thanh Village, Thu Thua District, Long An Province",Frozen; Dried
172,DL 404,Frozen Workshop - Yueh Chyang Canned Food Company Limited,"Nhut Chanh Village, Ben Luc District, Long An Province",Frozen
173,DL 443,"SIMMY SEAFOOD Co., Ltd.","Lot B04-1, Duc Hoa 1 Industrial Zone, Duc Hoa District, Long An Province",Frozen
174,DL 472,"Frozen workshop - PACIFIC SEAFOOD Co., Ltd. (PSC)","Lot La-1, Road No.1, Trans-asia Industrial&residential Park, Duc Hoa District, Long An Province",Frozen
175,DL 488,"Hoa Phat Aquatic products processing and trading service Co., Ltd","Hai Son Industrial Park, Binh Tien Ii Hamlet, Duc Hoa Ha Ward, Duc Hoa Street, Long An Province",Frozen
176,DL 719,GN Foods Joint Stock Company (GN FOODS),"Plot P.02b, Center Street, Long Hau Industrial Zone, Long Hau Commune, Can Giuoc District, Long An Province",Frozen
177,DL 738,Quoc Toan Seafood Processing Factory (QUOC TOAN PTE),"Lot Q.1a, Center Road, Long Hau Industrial Zone, Long Hau Ward, Can Giuoc District, Long An Province",Frozen
178,HK 216,"AN LAC SEAFOOD Co., Ltd - ALSF Co., LTD","Lot A14, Road 4a, Hai Son Industrial Zone, Duc Hoa District, Long An Province","""Dried; Alive; 
Live"""
179,HK 473,"Dried workshop -PACIFIC SEAFOOD Co., Ltd. (PSC)","Lot La-1, Road No.1, Trans-asia Industrial&residential Park, Duc Hoa District, Long An Province",Dried
180,DH 165,Yueh Chyang Canned Food Company Limited,"Hamlet 1, Nhut Chanh Village, Ben Luc District, Long An Province",Canned
181,DH 174,Foodtech Joint Stock Company (FOODTECH JSC),"Hamlet 1 , Nhut Chanh Village, Ben Luc District, Long An Province",Canned
182,NM 56,THANH NHA SAUCE P.T.E - BRANCH 1 (T.N PTE BR.1),"200b, Hamlet 9, Luong Hoa Village, Ben Luc District, Long An Province",Fish sauce
