no,product name,price,vendor,link
1515,Raf Simons Oversized Print Patch T-Shirt Black Man,3.200.000,Fred Perry,https://voila.id/collections/men/products/fred-perry-raf-simons-oversized-print-patch-t-shirt-black-man#
1516,Raf Simons Tipped Chest Patch Polo Shirt Black Man,3.400.000,Fred Perry,https://voila.id/collections/men/products/fred-perry-raf-simons-tipped-chest-patch-polo-shirt-black-man#
1517,Vintage Jacquard Monogram Medium Crossbody Bag Grey,8.400.000,MCM,https://voila.id/collections/men/products/mcm-vintage-jacquard-monogram-medium-crossbody-bag-grey#
1518,Jeans Couture Logo Print T-Shirt White,2.500.000,Versace,https://voila.id/collections/men/products/versace-jeans-couture-logo-print-t-shirt-white#
1519,Greca Polo Shirt Black White Man,4.600.000,Versace,https://voila.id/collections/men/products/versace-greca-polo-shirt-black-white-man#
1520,Round Neck SS Hexagon T-Shirt Black,4.300.000,Philipp Plein,https://voila.id/collections/men/products/philipp-plein-round-neck-ss-hexagon-t-shirt-black#
1521,Mini Saddle Messenger Bag Black Grained,33.000.000,Christian Dior,https://voila.id/collections/men/products/christian-dior-mini-saddle-messenger-bag-black-grained#
1522,"Pioneer DJ ""Sound Engineering"" Sweatshirt White",5.600.000,Off-White,https://voila.id/collections/men/products/off-white-pioneer-dj-sound-engineering-sweatshirt-white#
1523,Caravaggio Painting Sweatshirt Black Yellow,5.300.000,Off-White,https://voila.id/collections/men/products/off-white-caravaggio-painting-sweatshirt-black-yellow#
1524,Pioneer DJ Console Print T-Shirt Black,3.700.000,Off-White,https://voila.id/collections/men/products/off-white-pioneer-dj-console-print-t-shirt-black#
1525,Single Chain Feathers L/S Sweatshirt Black,3.900.000,Marcelo Burlon,https://voila.id/collections/men/products/marcelo-burlon-single-chain-feathers-l-s-sweatshirt-black#
1526,Missoni Heritage Nylon Bucket Hat Black,3.900.000,Palm Angels,https://voila.id/collections/men/products/palm-angels-missoni-heritage-nylon-bucket-hat-black#
1527,Brushed Leather Derby Shoes Black,8.100.000,Prada,https://voila.id/collections/men/products/prada-brushed-leather-derby-shoes-black#
1528,Logo Band Calfskin Slip On Sneakers White Black,4.400.000,Moschino,https://voila.id/collections/men/products/moschino-logo-band-calfskin-slip-on-sneakers-white-black#
1529,White Logo Box T-Shirt Black Man,1.900.000,MSGM,https://voila.id/collections/men/products/msgm-white-logo-box-t-shirt-black-man#
1530,SF Ornament Driver Loafers Black,5.800.000,Salvatore Ferragamo,https://voila.id/collections/men/products/salvatore-ferragamo-sf-ornament-driver-loafers-black#
1531,Interlocking G Star Brust Print Cotton Sweatshirt Black,11.700.000,Gucci,https://voila.id/collections/men/products/gucci-interlocking-g-star-brust-print-cotton-sweatshirt-black#
1532,Monogram Tablet Holder Black Smooth,6.800.000,Saint Laurent,https://voila.id/collections/men/products/saint-laurent-monogram-tablet-holder-black-smooth#
1533,M Sifnos Wallet Red White,4.100.000,Christian Louboutin,https://voila.id/collections/men/products/christian-louboutin-m-sifnos-wallet-red-white#
1534,Louis Junior Spikes Orlato Ecume,7.700.000,Christian Louboutin,https://voila.id/collections/men/products/christian-louboutin-louis-junior-spikes-orlato-ecume#
1535,Logo Print Camouflage Cotton Sneakers Mangrove Green,5.000.000,Burberry,https://voila.id/collections/men/products/burberry-logo-print-camouflage-cotton-sneakers-mangrove-green#
1536,Large Check E-canvas Zip Pouch Dark Birch Brown,6.200.000,Burberry,https://voila.id/collections/men/products/burberry-large-check-e-canvas-zip-pouch-dark-birch-brown#
1537,CT-02 Mid Sneakers White Black,7.000.000,Celine,https://voila.id/collections/men/products/celine-ct-02-mid-sneakers-white-black#
1538,Rubber Pool Slides With Logo White,2.200.000,Moschino,https://voila.id/collections/men/products/moschino-rubber-pool-slides-with-logo-white#
1539,Teddy Shoes Sneakers With Elastic Band Black,4.600.000,Moschino,https://voila.id/collections/men/products/moschino-teddy-shoes-sneakers-with-elastic-band-black#
1540,Moschino Cap Logo Double Question Embossed Black White,1.700.000,Moschino,https://voila.id/collections/men/products/moschino-moschino-cap-logo-double-question-embossed-black-white#
1541,Cap Logo Black White,2.000.000,Moschino,https://voila.id/collections/men/products/moschino-cap-logo-black-white#
1542,Cap Logo M0$c#!N@ Embroidered Black,2.000.000,Moschino,https://voila.id/collections/men/products/moschino-cap-logo-m0-c-n-embroidered-black#
1543,Cap Logo M0$c#!N@ White,1.900.000,Moschino,https://voila.id/collections/men/products/moschino-cap-logo-m0-c-n-white#
1544,New America's Cup Bike Fabric Sneakers Black,10.000.000,Prada,https://voila.id/collections/men/products/prada-new-americas-cup-bike-fabric-sneakers-black#
1545,Split The Check Backpack Brown Ghw,2.500.000,Sprayground,https://voila.id/collections/men/products/sprayground-split-the-check-backpack-brown-ghw#
1546,Paris VS Florence Backpack,2.500.000,Sprayground,https://voila.id/collections/men/products/sprayground-paris-vs-florence-backpack#
1547,"""New World Our Rules"" Mask Sweatshirts Dark Green",3.900.000,Ih Nom Uh Nit,https://voila.id/collections/men/products/ih-nom-uh-nit-new-world-our-rules-mask-sweatshirts-dark-green#
1548,"""New World Our Rules"" Mask Sweatshirts Warm Grey",3.900.000,Ih Nom Uh Nit,https://voila.id/collections/men/products/ih-nom-uh-nit-new-world-our-rules-mask-sweatshirts-warm-grey#
1549,"""New World Our Rules"" Mask Sweatshirts Blue",3.900.000,Ih Nom Uh Nit,https://voila.id/collections/men/products/ih-nom-uh-nit-new-world-our-rules-mask-sweatshirts-blue#
1550,"""New World Our Rules"" Mask Sweatshirts White",3.900.000,Ih Nom Uh Nit,https://voila.id/collections/men/products/ih-nom-uh-nit-new-world-our-rules-mask-sweatshirts-white#
1551,"""New World Our Rules"" Mask Sweatshirts Black",3.900.000,Ih Nom Uh Nit,https://voila.id/collections/men/products/ih-nom-uh-nit-new-world-our-rules-mask-sweatshirts-black#
1552,"""New World Our Rules"" Mask Hooded Sweatshirts Dark Green",4.300.000,Ih Nom Uh Nit,https://voila.id/collections/men/products/ih-nom-uh-nit-new-world-our-rules-mask-hooded-sweatshirts-dark-green#
1553,"""New World Our Rules"" Mask Hooded Sweatshirts Warm Grey",4.300.000,Ih Nom Uh Nit,https://voila.id/collections/men/products/ih-nom-uh-nit-new-world-our-rules-mask-hooded-sweatshirts-warm-grey#
1554,"""New World Our Rules"" Mask Hooded Sweatshirts Blue",4.300.000,Ih Nom Uh Nit,https://voila.id/collections/men/products/ih-nom-uh-nit-new-world-our-rules-mask-hooded-sweatshirts-blue#
1555,"""New World Our Rules"" Mask Hooded Sweatshirts White",4.300.000,Ih Nom Uh Nit,https://voila.id/collections/men/products/ih-nom-uh-nit-new-world-our-rules-mask-hooded-sweatshirts-white#
1556,"""New World Our Rules"" Mask Hooded Sweatshirts Black",4.300.000,Ih Nom Uh Nit,https://voila.id/collections/men/products/ih-nom-uh-nit-new-world-our-rules-mask-hooded-sweatshirts-black#
1557,"""New World Our Rules"" Mask T-Shirt Dark Green",2.800.000,Ih Nom Uh Nit,https://voila.id/collections/men/products/ih-nom-uh-nit-new-world-our-rules-mask-t-shirt-dark-green#
1558,"""New World Our Rules"" Mask T-Shirt Warm Grey",2.800.000,Ih Nom Uh Nit,https://voila.id/collections/men/products/ih-nom-uh-nit-new-world-our-rules-mask-t-shirt-warm-grey#
1559,"""New World Our Rules"" Mask T-Shirt Blue",2.800.000,Ih Nom Uh Nit,https://voila.id/collections/men/products/ih-nom-uh-nit-new-world-our-rules-mask-t-shirt-blue#
1560,"""New World Our Rules"" Mask T-Shirt White",2.800.000,Ih Nom Uh Nit,https://voila.id/collections/men/products/ih-nom-uh-nit-new-world-our-rules-mask-t-shirt-white#
1561,"""New World Our Rules"" Mask T-Shirt Black",2.800.000,Ih Nom Uh Nit,https://voila.id/collections/men/products/ih-nom-uh-nit-new-world-our-rules-mask-t-shirt-black#
1562,Beyonce Pearls Mask Print Sweatshirt Dark Green,3.600.000,Ih Nom Uh Nit,https://voila.id/collections/men/products/ih-nom-uh-nit-beyonce-pearls-mask-print-sweatshirt-dark-green#
1563,Beyonce Pearls Mask Print Sweatshirt Warm Grey,3.550.000,Ih Nom Uh Nit,https://voila.id/collections/men/products/ih-nom-uh-nit-beyonce-pearls-mask-print-sweatshirt-warm-grey#
1564,Beyonce Pearls Mask Print Sweatshirt Blue,4.600.000,Ih Nom Uh Nit,https://voila.id/collections/men/products/ih-nom-uh-nit-beyonce-pearls-mask-print-sweatshirt-blue#
1565,Beyonce Pearls Mask Print Sweatshirt White,4.250.000,Ih Nom Uh Nit,https://voila.id/collections/men/products/ih-nom-uh-nit-beyonce-pearls-mask-print-sweatshirt-white#
1566,Beyonce Pearls Mask Print Sweatshirt Black,4.600.000,Ih Nom Uh Nit,https://voila.id/collections/men/products/ih-nom-uh-nit-beyonce-pearls-mask-print-sweatshirt-black#
1567,Beyonce Pearls Mask Print Hooded Sweatshirt Grey,4.300.000,Ih Nom Uh Nit,https://voila.id/collections/men/products/ih-nom-uh-nit-beyonce-pearls-mask-print-hooded-sweatshirt-grey#
1568,Beyonce Pearls Mask Print Hooded Sweatshirt Blue,4.300.000,Ih Nom Uh Nit,https://voila.id/collections/men/products/ih-nom-uh-nit-beyonce-pearls-mask-print-hooded-sweatshirt-blue#
1569,Beyonce Pearls Mask Print Hooded Sweatshirt White,4.300.000,Ih Nom Uh Nit,https://voila.id/collections/men/products/ih-nom-uh-nit-beyonce-pearls-mask-print-hooded-sweatshirt-white#
1570,Beyonce Pearls Mask Print Hooded Sweatshirt Black,4.300.000,Ih Nom Uh Nit,https://voila.id/collections/men/products/ih-nom-uh-nit-beyonce-pearls-mask-print-hooded-sweatshirt-black#
1571,Beyonce Pearls Mask Print T-Shirt Warm Grey,2.750.000,Ih Nom Uh Nit,https://voila.id/collections/men/products/ih-nom-uh-nit-beyonce-pearls-mask-print-t-shirt-warm-grey#
1572,Beyonce Pearls Mask Print T-shirt Blue,3.100.000,Ih Nom Uh Nit,https://voila.id/collections/men/products/ih-nom-uh-nit-beyonce-pearls-mask-print-t-shirt-blue#
1573,Beyonce Pearls Mask Print T-Shirt White,2.800.000,Ih Nom Uh Nit,https://voila.id/collections/men/products/ih-nom-uh-nit-beyonce-pearls-mask-print-t-shirt-white#
1574,Beyonce Pearls Mask Print T-shirt Black,2.800.000,Ih Nom Uh Nit,https://voila.id/collections/men/products/ih-nom-uh-nit-beyonce-pearls-mask-print-t-shirt-black#
1575,Mask Blue Graphic-Print T-Shirt in Blue Grey,2.800.000,Ih Nom Uh Nit,https://voila.id/collections/men/products/ih-nom-uh-nit-mask-blue-graphic-print-t-shirt-in-blue-grey#
1576,David Statue Printed T-Shirt in Warm Grey,2.800.000,Ih Nom Uh Nit,https://voila.id/collections/men/products/ih-nom-uh-nit-david-statue-printed-t-shirt-in-warm-grey#
1577,David Statue Printed T-Shirt in White,2.800.000,Ih Nom Uh Nit,https://voila.id/collections/men/products/ih-nom-uh-nit-david-statue-printed-t-shirt-in-white#
1578,David Statue Printed T-Shirt in Black,2.800.000,Ih Nom Uh Nit,https://voila.id/collections/men/products/ih-nom-uh-nit-david-statue-printed-t-shirt-in-black#
1579,Dark Green Art-Print New World Statue T-Shirt,2.800.000,Ih Nom Uh Nit,https://voila.id/collections/men/products/ih-nom-uh-nit-dark-green-art-print-new-world-statue-t-shirt#
1580,Warm Grey Art-Print New World Statue T-Shirt,2.800.000,Ih Nom Uh Nit,https://voila.id/collections/men/products/ih-nom-uh-nit-warm-grey-art-print-new-world-statue-t-shirt#
1581,Blue Art-Print New World Statue T-Shirt,2.800.000,Ih Nom Uh Nit,https://voila.id/collections/men/products/ih-nom-uh-nit-blue-art-print-new-world-statue-t-shirt#
1582,White Art-Print New World Statue T-Shirt,2.800.000,Ih Nom Uh Nit,https://voila.id/collections/men/products/ih-nom-uh-nit-white-art-print-new-world-statue-t-shirt#
1583,Black Art-Print New World Statue T-Shirt,2.800.000,Ih Nom Uh Nit,https://voila.id/collections/men/products/ih-nom-uh-nit-black-art-print-new-world-statue-t-shirt#
1584,Sweatshirt Mask Face-Print Cotton in Dark Green,3.900.000,Ih Nom Uh Nit,https://voila.id/collections/men/products/ih-nom-uh-nit-sweatshirt-mask-face-print-cotton-in-dark-green#
1585,Sweatshirt Mask Face-Print Cotton in Warm Grey,3.900.000,Ih Nom Uh Nit,https://voila.id/collections/men/products/ih-nom-uh-nit-sweatshirt-mask-face-print-cotton-in-warm-grey#
1586,Sweatshirt Mask Face-Print Cotton in Blue,3.600.000,Ih Nom Uh Nit,https://voila.id/collections/men/products/ih-nom-uh-nit-sweatshirt-mask-face-print-cotton-in-blue#
1587,Sweatshirt Mask Face-Print Cotton in White,3.550.000,Ih Nom Uh Nit,https://voila.id/collections/men/products/ih-nom-uh-nit-sweatshirt-mask-face-print-cotton-in-white#
1588,Sweatshirt Mask Face-Print Cotton in Black,3.550.000,Ih Nom Uh Nit,https://voila.id/collections/men/products/ih-nom-uh-nit-sweatshirt-mask-face-print-cotton-in-black#
1589,‘Hoodie Mask’ Graphic-Print T-Shirt in Dark Green,3.100.000,Ih Nom Uh Nit,https://voila.id/collections/men/products/ih-nom-uh-nit-hoodie-mask-graphic-print-t-shirt-in-dark-green#
1590,‘Hoodie Mask’ Graphic-Print T-Shirt in Warm Grey,2.800.000,Ih Nom Uh Nit,https://voila.id/collections/men/products/ih-nom-uh-nit-hoodie-mask-graphic-print-t-shirt-in-warm-grey#
1591,‘Hoodie Mask’ Graphic-Print T-Shirt in Blue,2.800.000,Ih Nom Uh Nit,https://voila.id/collections/men/products/ih-nom-uh-nit-hoodie-mask-graphic-print-t-shirt-in-blue#
1592,‘Hoodie Mask’ Graphic-Print T-Shirt in White,2.800.000,Ih Nom Uh Nit,https://voila.id/collections/men/products/ih-nom-uh-nit-hoodie-mask-graphic-print-t-shirt-in-white#
1593,‘Hoodie Mask’ Graphic-Print T-Shirt in Black,2.800.000,Ih Nom Uh Nit,https://voila.id/collections/men/products/ih-nom-uh-nit-hoodie-mask-graphic-print-t-shirt-in-black#
1594,Mask Blue Graphic-Print T-Shirt in Dark Green,3.100.000,Ih Nom Uh Nit,https://voila.id/collections/men/products/ih-nom-uh-nit-mask-blue-graphic-print-t-shirt-in-dark-green#
1595,Mask Blue Graphic-Print T-Shirt in Warm Grey,2.800.000,Ih Nom Uh Nit,https://voila.id/collections/men/products/ih-nom-uh-nit-mask-blue-graphic-print-t-shirt-in-warm-grey#
1596,Mask Blue Graphic-Print T-Shirt in White,2.800.000,Ih Nom Uh Nit,https://voila.id/collections/men/products/ih-nom-uh-nit-mask-blue-graphic-print-t-shirt-in-white#
1597,Mask Blue Graphic-Print T-Shirt in Black,2.750.000,Ih Nom Uh Nit,https://voila.id/collections/men/products/ih-nom-uh-nit-mask-blue-graphic-print-t-shirt-in-black#
1598,Mask Green Graphic-Print T-Shirt in Warm Grey,3.100.000,Ih Nom Uh Nit,https://voila.id/collections/men/products/ih-nom-uh-nit-mask-green-graphic-print-t-shirt-in-warm-grey#
1599,Mask Green Graphic-Print T-Shirt in Blue Grey,2.750.000,Ih Nom Uh Nit,https://voila.id/collections/men/products/ih-nom-uh-nit-mask-green-graphic-print-t-shirt-in-blue-grey#
1600,Mask Green Graphic-Print T-Shirt in White,2.800.000,Ih Nom Uh Nit,https://voila.id/collections/men/products/ih-nom-uh-nit-mask-green-graphic-print-t-shirt-in-white#
1601,Mask Green Graphic-Print T-Shirt in Black,2.800.000,Ih Nom Uh Nit,https://voila.id/collections/men/products/ih-nom-uh-nit-mask-green-graphic-print-t-shirt-in-black#
1602,Mask Grey Graphic-Print T-Shirt in Dark Green,3.100.000,Ih Nom Uh Nit,https://voila.id/collections/men/products/ih-nom-uh-nit-mask-grey-graphic-print-t-shirt-in-dark-green#
1603,Mask Grey Graphic-Print T-Shirt in Warm Grey,2.750.000,Ih Nom Uh Nit,https://voila.id/collections/men/products/ih-nom-uh-nit-mask-grey-graphic-print-t-shirt-in-warm-grey#
1604,Mask Grey Graphic-Print T-Shirt in Blue,3.100.000,Ih Nom Uh Nit,https://voila.id/collections/men/products/ih-nom-uh-nit-mask-grey-graphic-print-t-shirt-in-blue#
1605,Mask Grey Graphic-Print T-Shirt in White,3.100.000,Ih Nom Uh Nit,https://voila.id/collections/men/products/ih-nom-uh-nit-mask-grey-graphic-print-t-shirt-in-white#
1606,Mask Grey Graphic-Print T-Shirt,2.800.000,Ih Nom Uh Nit,https://voila.id/collections/men/products/ih-nom-uh-nit-mask-grey-graphic-print-t-shirt#
1607,Mask Green Graphic-Print T-Shirt in Dark Green,2.800.000,Ih Nom Uh Nit,https://voila.id/collections/men/products/ih-nom-uh-nit-mask-green-graphic-print-t-shirt-in-dark-green#
1608,Louis Junior Spikes Orlato Suede - Blue,7.900.000,Christian Louboutin,https://voila.id/collections/men/products/christian-louboutin-louis-junior-spikes-orlato-suede-blue#
1609,Soft Derby L20 Loafer Black,8.000.000,Balenciaga,https://voila.id/collections/men/products/balenciaga-soft-derby-l20-loafer-black#
1610,Boat Logo Print T-Shirt Black Man,1.800.000,Billionaire Boys Club,https://voila.id/collections/men/products/billionaire-boys-club-boat-logo-print-t-shirt-black-man#
1611,Tiger Crest Cardigan Dove Grey Man,3.200.000,Kenzo,https://voila.id/collections/men/products/kenzo-tiger-crest-cardigan-dove-grey-man#
1612,Rockstud Rockrunner Camouflage Sneakers Black,6.500.000,Valentino Garavani,https://voila.id/collections/men/products/valentino-garavani-rockstud-rockrunner-camouflage-sneakers-black#
1613,Embellished Logo Pants Black,4.100.000,Moschino,https://voila.id/collections/men/products/moschino-embellished-logo-pants-black#
1614,Astral Wings Long Sleeve T-Shirt Black Man,2.800.000,Marcelo Burlon,https://voila.id/collections/men/products/marcelo-burlon-astral-wings-long-sleeve-t-shirt-black-man#
1615,Necklace T-Shirt Army Man,2.400.000,Marcelo Burlon,https://voila.id/collections/men/products/marcelo-burlon-necklace-t-shirt-army-man#
1616,Tiger Crest Merino Wool Jumper Black Man,2.800.000,Kenzo,https://voila.id/collections/men/products/kenzo-tiger-crest-merino-wool-jumper-black-man#
1617,Logo Multicoloured Sweatshirt Stone Grey,3.000.000,Kenzo,https://voila.id/collections/men/products/kenzo-logo-multicoloured-sweatshirt-stone-grey#
1618,Logo Multicoloured Sweatshirt Orange,2.900.000,Kenzo,https://voila.id/collections/men/products/kenzo-logo-multicoloured-sweatshirt-orange#
1619,K-Tiger Oversized T-Shirt Pearl Grey Man,1.900.000,Kenzo,https://voila.id/collections/men/products/kenzo-k-tiger-oversized-t-shirt-pearl-grey-man#
1620,K-Tiger Classic Sweatshirt Pearl Grey Man,2.600.000,Kenzo,https://voila.id/collections/men/products/kenzo-k-tiger-classic-sweatshirt-pearl-grey-man#
1621,Sport Baseball Cap Black,1.399.000,Kenzo,https://voila.id/collections/men/products/kenzo-sport-baseball-cap-black#
1622,Tiger Logo iPhone 12 Pro Max Case Sapphire,900.000,Kenzo,https://voila.id/collections/men/products/kenzo-tiger-logo-iphone-12-pro-max-case-sapphire#
1623,Tiger Crest Merino Wool Jumper Navy Man,2.900.000,Kenzo,https://voila.id/collections/men/products/kenzo-tiger-crest-merino-wool-jumper-navy-man#
1624,K-Tiger Oversized T-Shirt White Man,1.900.000,Kenzo,https://voila.id/collections/men/products/kenzo-k-tiger-oversized-t-shirt-white-man#
1625,Tiger Crest Casual Long Sleeved Shirt Green,2.100.000,Kenzo,https://voila.id/collections/men/products/kenzo-tiger-crest-casual-long-sleeved-shirt-green#
1626,Long Sleeved Slimfit Shirt Stone Grey,2.200.000,Kenzo,https://voila.id/collections/men/products/kenzo-long-sleeved-slimfit-shirt-stone-grey#
1627,Long Sleeved Slimfit Shirt Lime Tea,2.200.000,Kenzo,https://voila.id/collections/men/products/kenzo-long-sleeved-slimfit-shirt-lime-tea#
1628,Russell Athletic Tapered-Fit Trousers Dark Blue,2.700.000,Hugo Boss,https://voila.id/collections/men/products/hugo-boss-russell-athletic-tapered-fit-trousers-dark-blue#
1629,Russell Athletic Hoodie Dark Blue Man,2.150.000,Hugo Boss,https://voila.id/collections/men/products/hugo-boss-russell-athletic-hoodie-dark-blue-man#
1630,Russell Athletic Hoodie White Man,2.150.000,Hugo Boss,https://voila.id/collections/men/products/hugo-boss-russell-athletic-hoodie-white-man#
1631,Russell Athletic Hoodie Black Man,2.150.000,Hugo Boss,https://voila.id/collections/men/products/hugo-boss-russell-athletic-hoodie-black-man#
1632,T-Shirt Ikonik K Logo Print Black,1.800.000,Karl Lagerfeld,https://voila.id/collections/men/products/karl-lagerfeld-t-shirt-ikonik-k-logo-print-black#
1633,Cloudbust Air Technical Fabric Sneakers,8.000.000,Prada,https://voila.id/collections/men/products/prada-cloudbust-air-technical-fabric-sneakers#
1634,VLTN Pouch Calfskin Black,6.700.000,Valentino Garavani,https://voila.id/collections/men/products/valentino-garavani-vltn-pouch-calfskin-black#
1635,Pik Boat Suede Sneakers Yellow,7.800.000,Christian Louboutin,https://voila.id/collections/men/products/christian-louboutin-pik-boat-suede-sneakers-yellow#
1636,Intrecciato Hydrology leather Messenger Bag Thunder,29.800.000,Bottega Veneta,https://voila.id/collections/men/products/bottega-veneta-intrecciato-hydrology-leather-messenger-bag-thunder#
1637,Small VTLN Times Leather Crossbody Bag White Red,8.600.000,Valentino Garavani,https://voila.id/collections/men/products/valentino-garavani-small-vtln-times-leather-crossbody-bag-white-red#
1638,VLTN Leather Small Crossbody Bag Black,7.100.000,Valentino Garavani,https://voila.id/collections/men/products/valentino-garavani-vltn-leather-small-crossbody-bag-black#
1639,Paquieboat Loafer Beige,7.600.000,Christian Louboutin,https://voila.id/collections/men/products/christian-louboutin-paquieboat-loafer-beige#
1640,Jeans Couture Contrast Logo Print Oversize T-Shirt White Man,2.100.000,Versace,https://voila.id/collections/men/products/versace-jeans-couture-contrast-logo-print-oversize-t-shirt-white-man#
1641,Jeans Couture Etichetta Motif T-Shirt White Man,2.100.000,Versace,https://voila.id/collections/men/products/versace-jeans-couture-etichetta-motif-t-shirt-white-man#
1642,Jeans Couture Floral V-Emblem Print T-Shirt Black Man,2.600.000,Versace,https://voila.id/collections/men/products/versace-jeans-couture-floral-v-emblem-print-t-shirt-black-man#
1643,Jeans Couture Floral V-Emblem Print T-Shirt - Blue,2.600.000,Versace,https://voila.id/collections/men/products/versace-jeans-couture-floral-v-emblem-print-t-shirt-blue#
1644,Jeans Couture Floral V-Emblem Print T-Shirt White Man,2.300.000,Versace,https://voila.id/collections/men/products/versace-jeans-couture-floral-v-emblem-print-t-shirt-white-man#
1645,Jeans Couture Multi Logo Print T-Shirt Black Man,1.900.000,Versace,https://voila.id/collections/men/products/versace-jeans-couture-multi-logo-print-t-shirt-black-man#
1646,Jeans Couture V-Emblem Leaf T-Shirt White Man,2.100.000,Versace,https://voila.id/collections/men/products/versace-jeans-couture-v-emblem-leaf-t-shirt-white-man#
1647,Jeans Couture Baroque Motif Logo Print T-Shirt Black Man,1.800.000,Versace,https://voila.id/collections/men/products/versace-jeans-couture-baroque-motif-logo-print-t-shirt-black-man#
1648,Jeans Couture Logo Barcode Print T-Shirt Black Man,2.200.000,Versace,https://voila.id/collections/men/products/versace-jeans-couture-logo-barcode-print-t-shirt-black-man#
1649,Jeans Couture Logo Barcode Print T-Shirt White Man,2.200.000,Versace,https://voila.id/collections/men/products/versace-jeans-couture-logo-barcode-print-t-shirt-white-man#
1650,Jeans Couture V-Emblem Leaf Patch Polo Black Man,2.300.000,Versace,https://voila.id/collections/men/products/versace-jeans-couture-v-emblem-leaf-patch-polo-black-man#
1651,Bracelet Set Black & Raspberry,6.000.000,Christian Dior,https://voila.id/collections/men/products/christian-dior-bracelet-set-black-raspberry#
1652,World Tour B27 Low-Top Sneaker Oblique Navy Blue,17.000.000,Christian Dior,https://voila.id/collections/men/products/christian-dior-world-tour-b27-low-top-sneaker-oblique-navy-blue#
1653,World Tour B27 Low-Top Sneaker Oblique Red,17.000.000,Christian Dior,https://voila.id/collections/men/products/christian-dior-world-tour-b27-low-top-sneaker-oblique-red#
1654,World Tour Sling Bag Oblique Black,34.000.000,Christian Dior,https://voila.id/collections/men/products/christian-dior-world-tour-sling-bag-oblique-black#
1655,The Classic Check Cashmere Scarf Alabaster,4.500.000,Burberry,https://voila.id/collections/men/products/burberry-the-classic-check-cashmere-scarf-alabaster#
1656,The Classic Check Cashmere Scarf Navy,4.500.000,Burberry,https://voila.id/collections/men/products/burberry-the-classic-check-cashmere-scarf-navy#
1657,Logo Double Nylon Bodybag Black Yellow Strap,7.300.000,Off-White,https://voila.id/collections/men/products/off-white-logo-double-nylon-bodybag-black-yellow-strap#
1658,Loafer Logo Gold Driving Shoes Black,7.000.000,Prada,https://voila.id/collections/men/products/prada-loafer-logo-gold-driving-shoes-black#
1659,Slip-On Suede Black (Red Green Stripe),8.000.000,Gucci,https://voila.id/collections/men/products/gucci-slip-on-suede-black-red-green-stripe#
1660,Logo Glitter Hooded Sweatshirt Black Man,2.800.000,Billionaire Boys Club,https://voila.id/collections/men/products/billionaire-boys-club-logo-glitter-hooded-sweatshirt-black-man#
1661,Classic Monogram Belt Bag Black,11.200.000,Saint Laurent,https://voila.id/collections/men/products/saint-laurent-classic-monogram-belt-bag-black#
1662,Medusa Long Sleeve T-Shirt White Black Man,4.300.000,Versace,https://voila.id/collections/men/products/versace-medusa-long-sleeve-t-shirt-white-black-man#
1663,Medusa Logo Embroidered T-Shirt Navy Man,4.400.000,Versace,https://voila.id/collections/men/products/versace-medusa-logo-embroidered-t-shirt-navy-man#
1664,Pifpouch Techno Ombre Grey,7.900.000,Christian Louboutin,https://voila.id/collections/men/products/christian-louboutin-pifpouch-techno-ombre-grey#
1665,M Panettone Wallet Red White,6.300.000,Christian Louboutin,https://voila.id/collections/men/products/christian-louboutin-m-panettone-wallet-red-white#
1666,M Kios Cardholder Red White,3.400.000,Christian Louboutin,https://voila.id/collections/men/products/christian-louboutin-m-kios-cardholder-red-white#
1667,Jurassic Unicorn T-Shirt Black Man,4.000.000,Vetements,https://voila.id/collections/men/products/vetements-jurassic-unicorn-t-shirt-black-man#
1668,Transparent Oversized Sole Sneakers Black,6.500.000,Alexander McQueen,https://voila.id/collections/men/products/alexander-mcqueen-transparent-oversized-sole-sneakers-black#
1669,Oversized Sneakers Black White,6.400.000,Alexander McQueen,https://voila.id/collections/men/products/alexander-mcqueen-oversized-sneakers-black-white#
1670,Logo T-Shirt White Man,3.600.000,Versace,https://voila.id/collections/men/products/versace-logo-t-shirt-white-man-1#
