no,product name,price,vendor,link
520,Sfera Ebbasta Logo Print Hoodie Black,3.600.000,Evisu,https://voila.id/collections/men/products/evisu-sfera-ebbasta-logo-print-hoodie-black#
521,SS Zebra Casual Fit Shirt Blue,2.600.000,Paul Smith,https://voila.id/collections/men/products/paul-smith-ss-zebra-casual-fit-shirt-blue#
522,SS Zebra Casual Fit Shirt Pink,2.600.000,Paul Smith,https://voila.id/collections/men/products/paul-smith-ss-zebra-casual-fit-shirt-pink#
523,De Coeur T-Shirt Navy,2.600.000,Alexandre Mattiussi,https://voila.id/collections/men/products/alexandre-mattiussi-de-coeur-t-shirt-navy#
524,Vertical Logo T-Shirt Black,4.100.000,Amiri,https://voila.id/collections/men/products/amiri-vertical-logo-t-shirt-black#
525,Dice Pigment Dyed T-Shirt Natural,1.900.000,Stussy,https://voila.id/collections/men/products/stussy-dice-pigment-dyed-t-shirt-natural#
526,Dice Pigment Dyed T-Shirt Black,1.900.000,Stussy,https://voila.id/collections/men/products/stussy-dice-pigment-dyed-t-shirt-black#
527,Logo Print Basic T-Shirt White,1.900.000,Stussy,https://voila.id/collections/men/products/stussy-logo-print-basic-t-shirt-white#
528,Derby Mocassin Lace Up Shoes Black,4.900.000,Tod's,https://voila.id/collections/men/products/tods-derby-mocassin-lace-up-shoes-black#
529,France Logo Cotton T-Shirt - White,4.300.000,Vetements,https://voila.id/collections/men/products/vetements-france-logo-cotton-t-shirt-white#
530,K/Ikonik Logo Outline T-Shirt Black Gold,2.100.000,Karl Lagerfeld,https://voila.id/collections/men/products/karl-lagerfeld-k-ikonik-logo-outline-t-shirt-black-gold#
531,Italian Flag Logo Print T-Shirt - Black,4.300.000,Vetements,https://voila.id/collections/men/products/vetements-italian-flag-logo-print-t-shirt-black#
532,K/Ikonik Logo Gold Outline T-Shirt Black Silver,2.100.000,Karl Lagerfeld,https://voila.id/collections/men/products/karl-lagerfeld-k-ikonik-logo-gold-outline-t-shirt-black-silver#
533,K/Ikonik Logo Gold Outline T-Shirt White Black,2.100.000,Karl Lagerfeld,https://voila.id/collections/men/products/karl-lagerfeld-k-ikonik-logo-gold-outline-t-shirt-white-black#
534,Logo Print Merino Wool Jumper Black,8.300.000,Vetements,https://voila.id/collections/men/products/vetements-logo-print-merino-wool-jumper-black#
535,K/Ikonik Logo Outline T-Shirt White Silver,2.100.000,Karl Lagerfeld,https://voila.id/collections/men/products/karl-lagerfeld-k-ikonik-logo-outline-t-shirt-white-silver#
536,I Like Long Walks Printed T-Shirt - Grey,4.900.000,Vetements,https://voila.id/collections/men/products/vetements-i-like-long-walks-printed-t-shirt-grey#
537,Double Unicorn T-Shirt Pink,4.800.000,Vetements,https://voila.id/collections/men/products/vetements-double-unicorn-t-shirt-pink#
538,Double Unicorn T-Shirt White,4.800.000,Vetements,https://voila.id/collections/men/products/vetements-double-unicorn-t-shirt-white#
539,'Single' Oversized T-Shirt White,4.300.000,Vetements,https://voila.id/collections/men/products/vetements-single-oversized-t-shirt-white#
540,All-Over K/Ikonik Logo Print T-Shirt Black,2.100.000,Karl Lagerfeld,https://voila.id/collections/men/products/karl-lagerfeld-all-over-k-ikonik-logo-print-t-shirt-black#
541,All-Over K/Ikonik Logo Print T-Shirt White,1.950.000,Karl Lagerfeld,https://voila.id/collections/men/products/karl-lagerfeld-all-over-k-ikonik-logo-print-t-shirt-white#
542,Letter Print Polo Shirt Black Gold,2.200.000,Karl Lagerfeld,https://voila.id/collections/men/products/karl-lagerfeld-letter-print-polo-shirt-black-gold#
543,Letter Print Polo Shirt Black Silver,2.200.000,Karl Lagerfeld,https://voila.id/collections/men/products/karl-lagerfeld-letter-print-polo-shirt-black-silver#
544,Logo Embossed Polo Shirt Black,2.200.000,Karl Lagerfeld,https://voila.id/collections/men/products/karl-lagerfeld-logo-embossed-polo-shirt-black#
545,Logo Embossed Polo Shirt Dark Orange,2.200.000,Karl Lagerfeld,https://voila.id/collections/men/products/karl-lagerfeld-logo-embossed-polo-shirt-dark-orange#
546,Logo Embossed Polo Shirt Yellow,2.200.000,Karl Lagerfeld,https://voila.id/collections/men/products/karl-lagerfeld-logo-embossed-polo-shirt-yellow#
547,Logo Embossed Polo Shirt White,2.200.000,Karl Lagerfeld,https://voila.id/collections/men/products/karl-lagerfeld-logo-embossed-polo-shirt-white#
548,K/Ikonik Bucket Hat Black,2.100.000,Karl Lagerfeld,https://voila.id/collections/men/products/karl-lagerfeld-k-ikonik-bucket-hat-black#
549,Tumbled Leather Belt with Crossover DG Logo Buckle,4.300.000,Dolce & Gabbana,https://voila.id/collections/men/products/dolce-gabbana-tumbled-leather-belt-with-crossover-dg-logo-buckle#
550,Mixed-Materials Space Sneakers White/Silver,8.800.000,Dolce & Gabbana,https://voila.id/collections/men/products/dolce-gabbana-mixed-materials-space-sneakers-white-silver#
551,Portofino Sneakers Calfskin and Patent Leather White,7.800.000,Dolce & Gabbana,https://voila.id/collections/men/products/dolce-gabbana-portofino-sneakers-calfskin-and-patent-leather-white#
552,Idoso Boost - White Black,3.900.000,Y-3,https://voila.id/collections/men/products/y-3-idoso-boost-white-black#
553,M Classic Knit Full-Zip Sweater Black,3.500.000,Y-3,https://voila.id/collections/men/products/y-3-m-classic-knit-full-zip-sweater-black#
554,Logo Sweatshirt Grey Man,5.200.000,Moncler,https://voila.id/collections/men/products/moncler-logo-sweatshirt-grey-man#
555,Padded Cardigan Dark Army Green,9.300.000,Moncler,https://voila.id/collections/men/products/moncler-padded-cardigan-dark-army-green#
556,Problem Solver Print T-Shirt White Man,1.800.000,MC2 Saint Barth,https://voila.id/collections/men/products/mc2-saint-barth-problem-solver-print-t-shirt-white-man#
557,Logo Print Sandal Slides Grey White,3.000.000,Off-White,https://voila.id/collections/men/products/off-white-logo-print-sandal-slides-grey-white#
558,Jeans Couture Centered V-Emblem T-Shirt Black White,2.200.000,Versace,https://voila.id/collections/men/products/versace-jeans-couture-centered-v-emblem-t-shirt-black-white#
559,Jeans Couture Logo Piece NR Rubber T-Shirt All Black,2.300.000,Versace,https://voila.id/collections/men/products/versace-jeans-couture-logo-piece-nr-rubber-t-shirt-all-black#
560,Jeans Couture Logo Piece NR Rubber T-Shirt White Black,2.300.000,Versace,https://voila.id/collections/men/products/versace-jeans-couture-logo-piece-nr-rubber-t-shirt-white-black#
561,Jeans Couture Metallic V-Emblem Thick Foil T-Shirt Black Silver,2.100.000,Versace,https://voila.id/collections/men/products/versace-jeans-couture-metallic-v-emblem-thick-foil-t-shirt-black-silver#
562,Jeans Couture Metallic V-Emblem Thick Foil T-Shirt White Silver,2.200.000,Versace,https://voila.id/collections/men/products/versace-jeans-couture-metallic-v-emblem-thick-foil-t-shirt-white-silver#
563,Jeans Couture Metallic V-Emblem Thick Foil T-Shirt Black Gold,2.200.000,Versace,https://voila.id/collections/men/products/versace-jeans-couture-metallic-v-emblem-thick-foil-t-shirt-black-gold#
564,Jeans Couture Metallic V-Emblem Thick Foil T-Shirt White Gold,2.200.000,Versace,https://voila.id/collections/men/products/versace-jeans-couture-metallic-v-emblem-thick-foil-t-shirt-white-gold#
565,Jeans Couture Logo Pixel T-Shirt All Black,2.100.000,Versace,https://voila.id/collections/men/products/versace-jeans-couture-logo-pixel-t-shirt-all-black#
566,Hologram Logo T-Shirt White Multicolor,2.300.000,Versace,https://voila.id/collections/men/products/versace-hologram-logo-t-shirt-white-multicolor#
567,Hologram Logo T-Shirt Black Multicolor,2.200.000,Versace,https://voila.id/collections/men/products/versace-hologram-logo-t-shirt-black-multicolor#
568,Multi V-Emblem Hologram T-Shirt Black,2.200.000,Versace,https://voila.id/collections/men/products/versace-multi-v-emblem-hologram-t-shirt-black#
569,Baroque Patterns Print T-Shirt Black Man,2.200.000,Versace,https://voila.id/collections/men/products/versace-baroque-patterns-print-t-shirt-black-man#
570,Baroque Patterns Print T-Shirt White Man,2.200.000,Versace,https://voila.id/collections/men/products/versace-baroque-patterns-print-t-shirt-white-man#
571,Jeans Couture Logo Coin Sun Out T-Shirt Black,2.100.000,Versace,https://voila.id/collections/men/products/versace-jeans-couture-logo-coin-sun-out-t-shirt-black#
572,V-Emblem Polo Shirt Black Gold,2.100.000,Versace,https://voila.id/collections/men/products/versace-v-emblem-polo-shirt-black-gold#
573,V-Emblem Polo Shirt White Gold,2.100.000,Versace,https://voila.id/collections/men/products/versace-v-emblem-polo-shirt-white-gold#
574,VLTN Pocket-Size Cardholder Calfskin Leather,4.400.000,Valentino Garavani,https://voila.id/collections/men/products/valentino-garavani-vltn-pocket-size-cardholder-calfskin-leather#
575,Logo Print Oversized T-Shirt Black,3.800.000,Alexander McQueen,https://voila.id/collections/men/products/alexander-mcqueen-logo-print-oversized-t-shirt-black#
576,Skull Zip-Up Sweatshirt Black,6.300.000,Alexander McQueen,https://voila.id/collections/men/products/alexander-mcqueen-skull-zip-up-sweatshirt-black#
577,Spider Webs Cotton T-Shirt Black Man,4.800.000,Givenchy,https://voila.id/collections/men/products/givenchy-spider-webs-cotton-t-shirt-black-man#
578,Allover Logo Holiday Shirt White Man,4.600.000,Off-White,https://voila.id/collections/men/products/off-white-allover-logo-holiday-shirt-white-man#
579,Micro Simma Bi-Fold Wallet Black,4.400.000,Gucci,https://voila.id/collections/men/products/gucci-micro-simma-bi-fold-wallet-black#
580,GG Nylon Black Wallet,5.300.000,Gucci,https://voila.id/collections/men/products/gucci-gg-nylon-black-wallet#
581,222 Banda Anniston Slim Jacket Black Black,1.500.000,Kappa,https://voila.id/collections/men/products/kappa-222-banda-anniston-slim-jacket-black-black#
582,Jacquard Sweater Man Black,9.000.000,Givenchy,https://voila.id/collections/men/products/givenchy-jacquard-sweater-man-black#
583,222 Banda Anniston Slim Jacket Pink White Blue,1.500.000,Kappa,https://voila.id/collections/men/products/kappa-222-banda-anniston-slim-jacket-pink-white-blue#
584,222 Banda Anniston Slim Jacket Black White,1.500.000,Kappa,https://voila.id/collections/men/products/kappa-222-banda-anniston-slim-jacket-black-white#
585,222 Banda Anniston Slim Jacket White Black,1.500.000,Kappa,https://voila.id/collections/men/products/kappa-222-banda-anniston-slim-jacket-white-black#
586,GG Marmont Thin Belt All Black,6.400.000,Gucci,https://voila.id/collections/men/products/gucci-gg-marmont-thin-belt-all-black#
587,Underwear Logo Band Hooded Sweatshirt Grey,3.100.000,Moschino,https://voila.id/collections/men/products/moschino-underwear-logo-band-hooded-sweatshirt-grey#
588,Russel Athletic Pima Cotton Relaxed Fit T-Shirt Orange,1.600.000,Hugo Boss,https://voila.id/collections/men/products/hugo-boss-russel-athletic-pima-cotton-relaxed-fit-t-shirt-orange#
589,Russel Athletic Pima Cotton Relaxed Fit T-Shirt Dark Blue,1.600.000,Hugo Boss,https://voila.id/collections/men/products/hugo-boss-russel-athletic-pima-cotton-relaxed-fit-t-shirt-dark-blue#
590,Russel Athletic Pima Cotton Relaxed Fit T-Shirt White,1.600.000,Hugo Boss,https://voila.id/collections/men/products/hugo-boss-russel-athletic-pima-cotton-relaxed-fit-t-shirt-white#
591,Russel Athletic Pima Cotton Relaxed Fit T-Shirt Grey,1.600.000,Hugo Boss,https://voila.id/collections/men/products/hugo-boss-russel-athletic-pima-cotton-relaxed-fit-t-shirt-grey#
592,Foil-Printed Logo Regular Fit Hooded Sweatshirt Black,2.300.000,Hugo Boss,https://voila.id/collections/men/products/hugo-boss-foil-printed-logo-regular-fit-hooded-sweatshirt-black#
593,Track Sweat Jacket Zipper Black,2.300.000,Hugo Boss,https://voila.id/collections/men/products/hugo-boss-track-sweat-jacket-zipper-black#
594,Loungwear Metallic Logo Regular Fit Sweatshirt Black,2.100.000,Hugo Boss,https://voila.id/collections/men/products/hugo-boss-loungwear-metallic-logo-regular-fit-sweatshirt-black#
595,Authentic Z Metallic Logo Jacket Grey,2.100.000,Hugo Boss,https://voila.id/collections/men/products/hugo-boss-authentic-z-metallic-logo-jacket-grey#
596,Authentic Sweatshirt Grey,2.100.000,Hugo Boss,https://voila.id/collections/men/products/hugo-boss-authentic-sweatshirt-grey#
597,Authentic Jacket H Grey,2.200.000,Hugo Boss,https://voila.id/collections/men/products/hugo-boss-authentic-jacket-h-grey#
598,Stedman RA-2 Sweatshirt Dark Blue,2.600.000,Hugo Boss,https://voila.id/collections/men/products/hugo-boss-stedman-ra-2-sweatshirt-dark-blue#
599,Stedman RA-2 Sweatshirt White,2.700.000,Hugo Boss,https://voila.id/collections/men/products/hugo-boss-stedman-ra-2-sweatshirt-white#
600,Stedman RA-2 Sweatshirt Medium Gray,2.400.000,Hugo Boss,https://voila.id/collections/men/products/hugo-boss-stedman-ra-2-sweatshirt-medium-gray#
601,Logo Artwork French Terry Sweatshirt Black Man,2.700.000,Hugo Boss,https://voila.id/collections/men/products/hugo-boss-logo-artwork-french-terry-sweatshirt-black-man#
602,Passenger 1 Polo Shirt White Grey,1.800.000,Hugo Boss,https://voila.id/collections/men/products/hugo-boss-passenger-1-polo-shirt-white-grey#
603,Patterned Collar Regular Fit Polo Shirt Purple,1.900.000,Hugo Boss,https://voila.id/collections/men/products/hugo-boss-patterned-collar-regular-fit-polo-shirt-purple#
604,Patterned Collar Regular Fit Polo Shirt Light Blue,2.000.000,Hugo Boss,https://voila.id/collections/men/products/hugo-boss-patterned-collar-regular-fit-polo-shirt-light-blue#
605,Patterned Collar Regular Fit Polo Shirt Dark Blue,2.000.000,Hugo Boss,https://voila.id/collections/men/products/hugo-boss-patterned-collar-regular-fit-polo-shirt-dark-blue#
606,Patterned Collar Regular Fit Polo Shirt Coffee,2.000.000,Hugo Boss,https://voila.id/collections/men/products/hugo-boss-patterned-collar-regular-fit-polo-shirt-coffee#
607,Patterned Collar Regular Fit Polo Shirt Black,2.000.000,Hugo Boss,https://voila.id/collections/men/products/hugo-boss-patterned-collar-regular-fit-polo-shirt-black#
608,Patterned Collar Regular Fit Polo Shirt Light Grey,1.900.000,Hugo Boss,https://voila.id/collections/men/products/hugo-boss-patterned-collar-regular-fit-polo-shirt-light-grey#
609,Polo Paras 10 Black,2.200.000,Hugo Boss,https://voila.id/collections/men/products/hugo-boss-polo-paras-10-black#
610,Pemix Cotton Pique Logo Patch Regular Fit Polo Shirt Khaki,1.900.000,Hugo Boss,https://voila.id/collections/men/products/hugo-boss-pemix-cotton-pique-logo-patch-regular-fit-polo-shirt-khaki#
611,Pemix Cotton Pique Logo Patch Regular Fit Polo Shirt Grey,1.900.000,Hugo Boss,https://voila.id/collections/men/products/hugo-boss-pemix-cotton-pique-logo-patch-regular-fit-polo-shirt-grey#
612,Branded Patch Relaxed-Fit Varsity Jacket Navy,3.100.000,Hugo Boss,https://voila.id/collections/men/products/hugo-boss-branded-patch-relaxed-fit-varsity-jacket-navy#
613,Branded Patch Relaxed-Fit Varsity Jacket Grey,3.100.000,Hugo Boss,https://voila.id/collections/men/products/hugo-boss-branded-patch-relaxed-fit-varsity-jacket-grey#
614,Polo Parley 139 Dark Blue,1.900.000,Hugo Boss,https://voila.id/collections/men/products/hugo-boss-polo-parley-139-dark-blue#
615,Polo Parley 139 Green,1.900.000,Hugo Boss,https://voila.id/collections/men/products/hugo-boss-polo-parley-139-green#
616,Polo Parley 139 Dark Brown,1.900.000,Hugo Boss,https://voila.id/collections/men/products/hugo-boss-polo-parley-139-dark-brown#
617,Polo Parley 139 Grey,1.900.000,Hugo Boss,https://voila.id/collections/men/products/hugo-boss-polo-parley-139-grey#
618,Polo Parley 139 Black,1.900.000,Hugo Boss,https://voila.id/collections/men/products/hugo-boss-polo-parley-139-black#
619,Pavel Polo Shirt Navy,2.100.000,Hugo Boss,https://voila.id/collections/men/products/hugo-boss-pavel-polo-shirt-navy#
620,Pavel Polo Shirt Brown,2.100.000,Hugo Boss,https://voila.id/collections/men/products/hugo-boss-pavel-polo-shirt-brown#
621,Pirax Pocket Polo Shirt Navy,2.100.000,Hugo Boss,https://voila.id/collections/men/products/hugo-boss-pirax-pocket-polo-shirt-navy#
622,Pirax Pocket Polo Shirt Black,2.100.000,Hugo Boss,https://voila.id/collections/men/products/hugo-boss-pirax-pocket-polo-shirt-black#
623,Biadia_R Shirt Purple,2.200.000,Hugo Boss,https://voila.id/collections/men/products/hugo-boss-biadia_r-shirt-purple#
624,Biadia_R Shirt Grey,2.200.000,Hugo Boss,https://voila.id/collections/men/products/hugo-boss-biadia_r-shirt-grey-1#
625,Paddy Regular Fit Polo Shirt Yellow,1.900.000,Hugo Boss,https://voila.id/collections/men/products/hugo-boss-paddy-regular-fit-polo-shirt-yellow#
626,Paddy Regular Fit Polo Shirt Purple,1.800.000,Hugo Boss,https://voila.id/collections/men/products/hugo-boss-paddy-regular-fit-polo-shirt-purple#
627,Paddy Regular Fit Polo Shirt Lilac,1.800.000,Hugo Boss,https://voila.id/collections/men/products/hugo-boss-paddy-regular-fit-polo-shirt-lilac#
628,Paddy Regular Fit Polo Shirt Navy,2.000.000,Hugo Boss,https://voila.id/collections/men/products/hugo-boss-paddy-regular-fit-polo-shirt-navy#
629,Paddy Regular Fit Polo Shirt Brown,1.900.000,Hugo Boss,https://voila.id/collections/men/products/hugo-boss-paddy-regular-fit-polo-shirt-brown#
630,Paddy Regular Fit Polo Shirt Beige,1.900.000,Hugo Boss,https://voila.id/collections/men/products/hugo-boss-paddy-regular-fit-polo-shirt-beige#
631,Polo Paddy Regular Fit Polo Shirt Dark Grey,1.900.000,Hugo Boss,https://voila.id/collections/men/products/hugo-boss-polo-paddy-regular-fit-polo-shirt-dark-grey#
632,Polo Paddy Regular Fit Polo Shirt Black,1.900.000,Hugo Boss,https://voila.id/collections/men/products/hugo-boss-polo-paddy-regular-fit-polo-shirt-black#
633,Zip-Through Hooded Sweater Light Green,2.100.000,Hugo Boss,https://voila.id/collections/men/products/hugo-boss-zip-through-hooded-sweater-light-green#
634,Sport 'Big X' T-Shirt Blue,2.300.000,Kenzo,https://voila.id/collections/men/products/kenzo-sport-big-x-t-shirt-blue#
635,Loungwear Jacket Regular Fit Light Grey,2.100.000,Hugo Boss,https://voila.id/collections/men/products/hugo-boss-loungwear-jacket-regular-fit-light-grey#
636,Loungwear Jacket Regular Fit Black,2.100.000,Hugo Boss,https://voila.id/collections/men/products/hugo-boss-loungwear-jacket-regular-fit-black#
637,Loungwear Jacket Regular Fit Black,2.100.000,Hugo Boss,https://voila.id/collections/men/products/hugo-boss-loungwear-jacket-regular-fit-black-1#
638,Tiger Pullover Hooded Sweatshirt Dark Green - Man,3.400.000,Kenzo,https://voila.id/collections/men/products/kenzo-tiger-pullover-hooded-sweatshirt-dark-green-man#
639,Tiger Classic Cut Sweatshirt Dark Khaki,3.000.000,Kenzo,https://voila.id/collections/men/products/kenzo-tiger-classic-cut-sweatshirt-dark-khaki#
640,Tiger Organic Cotton T-Shirt - Black Man,2.100.000,Kenzo,https://voila.id/collections/men/products/kenzo-tiger-organic-cotton-t-shirt-black-man#
641,Location Print Cotton Oversized T-Shirt White,5.100.000,Burberry,https://voila.id/collections/men/products/burberry-location-print-cotton-oversized-t-shirt-white#
642,Check Hood Cotton Blend Hoodie Top Black,7.800.000,Burberry,https://voila.id/collections/men/products/burberry-check-hood-cotton-blend-hoodie-top-black#
643,"""SL League"" T-Shirt Navy - Man",3.600.000,Saint Laurent,https://voila.id/collections/men/products/saint-laurent-sl-league-t-shirt-navy-man#
644,Talon' with Tone-On-Tone Leather Sneakers White,7.800.000,Giuseppe Zanotti,https://voila.id/collections/men/products/giuseppe-zanotti-talon-with-tone-on-tone-leather-sneakers-white#
645,Track Top Jacket Black,5.300.000,424,https://voila.id/collections/men/products/424-track-top-jacket-black#
646,Venetian Leather Oxford Shoes - Dark Brown,17.000.000,Berluti,https://voila.id/collections/men/products/berluti-venetian-leather-oxford-shoes-dark-brown#
647,Ceresio9 Cool T-Shirt White,2.800.000,Dsquared2,https://voila.id/collections/men/products/dsquared2-ceresio9-cool-t-shirt-white#
648,MA Core T-Shirt Black,4.100.000,Amiri,https://voila.id/collections/men/products/amiri-ma-core-t-shirt-black#
649,Reverse Playboy T-Shirt White,4.300.000,Amiri,https://voila.id/collections/men/products/amiri-reverse-playboy-t-shirt-white#
650,Playboy Rainbow Tee Black,4.200.000,Amiri,https://voila.id/collections/men/products/amiri-playboy-rainbow-tee-black#
651,Vertical Logo T-Shirt White,4.000.000,Amiri,https://voila.id/collections/men/products/amiri-vertical-logo-t-shirt-white#
652,Temple T-Shirt Black,2.100.000,Aries,https://voila.id/collections/men/products/aries-temple-t-shirt-black#
653,No Problemo T-Shirt White,2.100.000,Aries,https://voila.id/collections/men/products/aries-no-problemo-t-shirt-white#
654,No Problemo T-Shirt Black,2.100.000,Aries,https://voila.id/collections/men/products/aries-no-problemo-t-shirt-black#
655,Sfera Ebbasta Logo Print Hoodie White,3.300.000,Evisu,https://voila.id/collections/men/products/evisu-sfera-ebbasta-logo-print-hoodie-white#
656,Sfera Ebbasta Logo-Print Denim Shorts Indigo,3.600.000,Evisu,https://voila.id/collections/men/products/evisu-sfera-ebbasta-logo-print-denim-shorts-indigo#
657,Re-Nylon Bucket Hat Alabaster Pink,6.800.000,Prada,https://voila.id/collections/men/products/prada-re-nylon-bucket-hat-alabaster-pink#
658,Shearling Pouch Black,10.200.000,Prada,https://voila.id/collections/men/products/prada-shearling-pouch-black#
659,Logo Berlin Low Cut Sneakers White Blue Navy,1.500.000,Kappa,https://voila.id/collections/men/products/kappa-logo-berlin-low-cut-sneakers-white-blue-navy#
660,Straight Logo Long Sleeve T-Shirt Black,2.300.000,Billionaire Boys Club,https://voila.id/collections/men/products/billionaire-boys-club-straight-logo-long-sleeve-t-shirt-black#
661,Logo Chain Embellished T-Shirt Black,3.200.000,GCDS,https://voila.id/collections/men/products/gcds-logo-chain-embellished-t-shirt-black#
662,New Logo Band T-Shirt White,3.000.000,GCDS,https://voila.id/collections/men/products/gcds-new-logo-band-t-shirt-white#
663,Hal Leather Crossbody Bag Black,5.200.000,Bally,https://voila.id/collections/men/products/bally-hal-leather-crossbody-bag-black#
664,Benery Leather Necessaire Black,4.300.000,Bally,https://voila.id/collections/men/products/bally-benery-leather-necessaire-black#
665,Teddy Bear Tennis Sneakers Black Brown,4.500.000,Palm Angels,https://voila.id/collections/men/products/palm-angels-teddy-bear-tennis-sneakers-black-brown#
666,2.Zero Custom Sneakers Black/Argento,8.000.000,Dolce & Gabbana,https://voila.id/collections/men/products/dolce-gabbana-2-zero-custom-sneakers-black-argento#
667,VLTN Logo-Print Clutch Bag White Red,8.200.000,Valentino Garavani,https://voila.id/collections/men/products/valentino-garavani-vltn-logo-print-clutch-bag-white-red#
668,Glossy Patent Leather Derby Shoes Black,7.000.000,Dolce & Gabbana,https://voila.id/collections/men/products/dolce-gabbana-glossy-patent-leather-derby-shoes-black#
669,Logo Label T-Shirt Black,4.100.000,Vetements,https://voila.id/collections/men/products/vetements-logo-label-t-shirt-black#
670,Logo Tape Hoodie Black,7.300.000,Vetements,https://voila.id/collections/men/products/vetements-logo-tape-hoodie-black#
671,Polo Shirt Black Green White,1.800.000,Fred Perry,https://voila.id/collections/men/products/fred-perry-polo-shirt-black-green-white#
672,One Stud Mid-Top Nappa Sneakers Red,7.500.000,Valentino Garavani,https://voila.id/collections/men/products/valentino-garavani-one-stud-mid-top-nappa-sneakers-red#
673,Gray Tech Fabric Low-Top Sneakers,7.500.000,Fendi,https://voila.id/collections/men/products/fendi-gray-tech-fabric-low-top-sneakers#
674,FF Logo-Intarsia Crew Neck Jumper Man,7.800.000,Fendi,https://voila.id/collections/men/products/fendi-ff-logo-intarsia-crew-neck-jumper-man#
675,Moccanio Star Applications Loafer Black,6.500.000,Jimmy Choo,https://voila.id/collections/men/products/jimmy-choo-moccanio-star-applications-loafer-black#
676,Memphis Neoprene Low Top Sneakers Black,5.800.000,Jimmy Choo,https://voila.id/collections/men/products/jimmy-choo-memphis-neoprene-low-top-sneakers-black#
677,Gancini Tubular Ornament Driver Black,6.400.000,Salvatore Ferragamo,https://voila.id/collections/men/products/salvatore-ferragamo-gancini-tubular-ornament-driver-black#
678,White Jersey Decorated Multicolour Patch sweatshirt,9.800.000,Fendi,https://voila.id/collections/men/products/fendi-white-jersey-decorated-multicolour-patch-sweatshirt#
679,The Simpsons Market Cowabunga Arc T-Shirt Black Man,2.000.000,Chinatown Market,https://voila.id/collections/men/products/chinatown-market-the-simpsons-market-cowabunga-arc-t-shirt-black-man#
680,Men's Multicolor Sporty B Tracksuit T-Shirt,7.300.000,Balenciaga,https://voila.id/collections/men/products/balenciaga-mens-multicolor-sporty-b-tracksuit-t-shirt#
681,Neo Classic Medium Top Handle Bag Black,22.700.000,Balenciaga,https://voila.id/collections/men/products/balenciaga-neo-classic-medium-top-handle-bag-black-1#
682,Monogram Printed  All Over Logo Shirt - Men,8.800.000,Balenciaga,https://voila.id/collections/men/products/balenciaga-monogram-printed-all-over-logo-shirt-men#
683,College Small Fit T-Shirt Navy,5.800.000,Balenciaga,https://voila.id/collections/men/products/balenciaga-college-small-fit-t-shirt-navy#
684,GG Knit Cashmere Jacquard Cardigan - Man,14.400.000,Gucci,https://voila.id/collections/men/products/gucci-gg-knit-cashmere-jacquard-cardigan-man#
685,Mirror Logo Print T-Shirt Ivory,5.800.000,Gucci,https://voila.id/collections/men/products/gucci-mirror-logo-print-t-shirt-ivory#
686,Navy Spooky Velvet Loafer Navy Black,9.300.000,Christian Louboutin,https://voila.id/collections/men/products/christian-louboutin-navy-spooky-velvet-loafer-navy-black#
687,Louis Junior Spikes Sneakers Suede Man Dark Grey,8.500.000,Christian Louboutin,https://voila.id/collections/men/products/christian-louboutin-louis-junior-spikes-sneakers-suede-man-dark-grey#
688,Lou Spikes 000 High Top Sneakers Black,8.500.000,Christian Louboutin,https://voila.id/collections/men/products/christian-louboutin-lou-spikes-000-high-top-sneakers-black#
689,Worker Boot Black,8.800.000,Alexander McQueen,https://voila.id/collections/men/products/alexander-mcqueen-worker-boot-black#
