no,product name,price,vendor,link
1020,Presage Enamel Series Automatic White Enamel Dial Dark Black Leather Strap,11.420.000,Seiko,https://voila.id/collections/men/products/seiko-presage-enamel-series-automatic-white-enamel-dial-dark-black-leather-strap#
1021,T-Touch Expert Solar Jungfraubahn Man Black Dial Orange Rubber Strap,12.016.000,Tissot,https://voila.id/collections/men/products/tissot-t-touch-expert-solar-jungfraubahn-man-black-dial-orange-rubber-strap#
1022,T-Touch Solar Perpetual Digital Analog Dial Black Leather Strap,11.776.000,Tissot,https://voila.id/collections/men/products/tissot-t-touch-solar-perpetual-digital-analog-dial-black-leather-strap#
1023,Ballade Powermatic 80 Cosc Men Silver Dial Dual Tone Stainless Steel,13.056.000,Tissot,https://voila.id/collections/men/products/tissot-ballade-powermatic-80-cosc-men-silver-dial-dual-tone-stainless-steel#
1024,Le Locle Automatic Chrono Valjoux Black Dial Leather Strap,17.920.000,Tissot,https://voila.id/collections/men/products/tissot-le-locle-automatic-chrono-valjoux-black-dial-leather-strap#
1025,Le Locle Automatic Petite,10.368.000,Tissot,https://voila.id/collections/men/products/tissot-le-locle-automatic-petite#
1026,Caravaggio Boy Print T-Shirt White,3.600.000,Off-White,https://voila.id/collections/men/products/off-white-caravaggio-boy-print-t-shirt-white#
1027,T-Classic Bridgeport Chrono Automatic Silver Dial Dual Tone St.Steel Strap,22.753.000,Tissot,https://voila.id/collections/men/products/tissot-t-classic-bridgeport-chrono-automatic-silver-dial-dual-tone-st-steel-strap#
1028,Dorada White Dial Dual Tone Stainless Steel Strap,5.680.000,Mido,https://voila.id/collections/men/products/mido-dorada-white-dial-dual-tone-stainless-steel-strap-2#
1029,Multifort Chronograph Black Dial Black Leather Strap,9.120.000,Mido,https://voila.id/collections/men/products/mido-multifort-chronograph-black-dial-black-leather-strap-1#
1030,Commander Datoday Automatic Silver Dial Dual Tone Stainless Steel Strap,14.560.000,Mido,https://voila.id/collections/men/products/mido-commander-datoday-automatic-silver-dial-dual-tone-stainless-steel-strap#
1031,Commander II Big Date Automatic Silver Dial Stainless Steel Strap,13.120.000,Mido,https://voila.id/collections/men/products/mido-commander-ii-big-date-automatic-silver-dial-stainless-steel-strap#
1032,Baroncelli III Chronometer Cal. 80 Automatic Black Dial St. Steel Strap,16.480.000,Mido,https://voila.id/collections/men/products/mido-baroncelli-iii-chronometer-cal-80-automatic-black-dial-st-steel-strap#
1033,Commander II Chronometer Automatic Silver Dial Stainless Steel Strap,17.040.000,Mido,https://voila.id/collections/men/products/mido-commander-ii-chronometer-automatic-silver-dial-stainless-steel-strap-1#
1034,Commander Icone Grey Dial Mesh Strap,17.040.000,Mido,https://voila.id/collections/men/products/mido-commander-icone-grey-dial-mesh-strap#
1035,Commander Shade Automatic Silver Dial Rose Gold Mesh Strap,13.600.000,Mido,https://voila.id/collections/men/products/mido-commander-shade-automatic-silver-dial-rose-gold-mesh-strap#
1036,Multifort Automatic Silver Dial Dual Tone Stainless Steel Strap,13.200.000,Mido,https://voila.id/collections/men/products/mido-multifort-automatic-silver-dial-dual-tone-stainless-steel-strap-1#
1037,Belluna II Automatic Silver Dial Black Leather Strap,12.080.000,Mido,https://voila.id/collections/men/products/mido-belluna-ii-automatic-silver-dial-black-leather-strap#
1038,Baroncelli Big Date Automatic Grey Dial Dual Tone Stainless Steel Strap,14.880.000,Mido,https://voila.id/collections/men/products/mido-baroncelli-big-date-automatic-grey-dial-dual-tone-stainless-steel-strap#
1039,Baroncelli Power Reserve White Dial Dual Tone Strainless Steel Strap,21.280.000,Mido,https://voila.id/collections/men/products/mido-baroncelli-power-reserve-white-dial-dual-tone-strainless-steel-strap#
1040,Multifort Automatic Black Dial Grey Leather Strap,12.480.000,Mido,https://voila.id/collections/men/products/mido-multifort-automatic-black-dial-grey-leather-strap#
1041,Multifort Automatic Green Olive Dial Khaki Leather Strap,12.480.000,Mido,https://voila.id/collections/men/products/mido-multifort-automatic-green-olive-dial-khaki-leather-strap#
1042,Dorada White Dial Gold Stainless Steel Strap,6.320.000,Mido,https://voila.id/collections/men/products/mido-dorada-white-dial-gold-stainless-steel-strap-1#
1043,Baroncelli II Automatic White Dial Dual Tone Stainless Steel Strap,12.560.000,Mido,https://voila.id/collections/men/products/mido-baroncelli-ii-automatic-white-dial-dual-tone-stainless-steel-strap-1#
1044,Multifort Automatic Black Dial Black Leather Strap,14.160.000,Mido,https://voila.id/collections/men/products/mido-multifort-automatic-black-dial-black-leather-strap#
1045,Belluna II Automatic Silver Dial Brown Leather Strap,14.080.000,Mido,https://voila.id/collections/men/products/mido-belluna-ii-automatic-silver-dial-brown-leather-strap#
1046,Belluna II Automatic Blue Dial Stainless Steel Strap,11.680.000,Mido,https://voila.id/collections/men/products/mido-belluna-ii-automatic-blue-dial-stainless-steel-strap#
1047,Commander II Chronometer Automatic Silver Dial Stainless Steel Strap,18.240.000,Mido,https://voila.id/collections/men/products/mido-commander-ii-chronometer-automatic-silver-dial-stainless-steel-strap#
1048,All Dial Chronometer Automatic White Dial Stainless Steel Strap,15.920.000,Mido,https://voila.id/collections/men/products/mido-all-dial-chronometer-automatic-white-dial-stainless-steel-strap#
1049,Belluna II Royal Gent Silver Dial Stainless Steel Strap,12.325.000,Mido,https://voila.id/collections/men/products/mido-belluna-ii-royal-gent-silver-dial-stainless-steel-strap#
1050,Commander II Chronograph Automatic Blue Dial Stainless Steel Strap,27.040.000,Mido,https://voila.id/collections/men/products/mido-commander-ii-chronograph-automatic-blue-dial-stainless-steel-strap#
1051,Commander II Big Date Automatic Silver Dial Dual Tone Stainless Steel Strap,14.880.000,Mido,https://voila.id/collections/men/products/mido-commander-ii-big-date-automatic-silver-dial-dual-tone-stainless-steel-strap#
1052,Commander II Big Date Automatic Black Dial Black Leather Strap,13.360.000,Mido,https://voila.id/collections/men/products/mido-commander-ii-big-date-automatic-black-dial-black-leather-strap#
1053,Baroncelli III Heritage Automatic Gent Black Dial Black Stainless Steel,17.760.000,Mido,https://voila.id/collections/men/products/mido-baroncelli-iii-heritage-automatic-gent-black-dial-black-stainless-steel#
1054,Commander Icone Black Dial Black Mesh Strap,19.280.000,Mido,https://voila.id/collections/men/products/mido-commander-icone-black-dial-black-mesh-strap#
1055,Multifort Patrimony Automatic Brown Dial Dark Brown Patina Leather Strap,13.280.000,Mido,https://voila.id/collections/men/products/mido-multifort-patrimony-automatic-brown-dial-dark-brown-patina-leather-strap#
1056,Sailing T-Touch Man Blue Digital Analog Dial Black Rubber Strap,12.800.000,Tissot,https://voila.id/collections/men/products/tissot-sailing-t-touch-man-blue-digital-analog-dial-black-rubber-strap#
1057,Ocean Star Captain Chronograph Blue Dial Titanium Strap,33.600.000,Mido,https://voila.id/collections/men/products/mido-ocean-star-captain-chronograph-blue-dial-titanium-strap#
1058,Sailing T-Touch Man Black Digital Analog Dial Black Rubber Strap,12.800.000,Tissot,https://voila.id/collections/men/products/tissot-sailing-t-touch-man-black-digital-analog-dial-black-rubber-strap-2#
1059,Multifort Chronograph Black Dial Black Leather Strap,7.600.000,Mido,https://voila.id/collections/men/products/mido-multifort-chronograph-black-dial-black-leather-strap#
1060,Multifort Automatic Silver Dial Brown Leather Strap,12.080.000,Mido,https://voila.id/collections/men/products/mido-multifort-automatic-silver-dial-brown-leather-strap#
1061,Commander Datoday Automatic Gold Dial Gold Stainless Steel Strap,14.880.000,Mido,https://voila.id/collections/men/products/mido-commander-datoday-automatic-gold-dial-gold-stainless-steel-strap#
1062,Commander Big Date Grey Dial Stainless Steel Strap,14.880.000,Mido,https://voila.id/collections/men/products/mido-commander-big-date-grey-dial-stainless-steel-strap#
1063,Ocean Star Caliber 80 Automatic Black Dial Dual Tone Stainless Steel Strap,14.560.000,Mido,https://voila.id/collections/men/products/mido-ocean-star-caliber-80-automatic-black-dial-dual-tone-stainless-steel-strap#
1064,Ocean Star Caliber 80 Automatic Black Dial Black Rubber Strap,13.760.000,Mido,https://voila.id/collections/men/products/mido-ocean-star-caliber-80-automatic-black-dial-black-rubber-strap#
1065,Ocean Star Caliber 80 Automatic Black Dial Titanium Strap,14.480.000,Mido,https://voila.id/collections/men/products/mido-ocean-star-caliber-80-automatic-black-dial-titanium-strap#
1066,Ocean Star Tribute 75th Anniversary Black Dial St. Steel Special Edition,15.680.000,Mido,https://voila.id/collections/men/products/mido-ocean-star-tribute-75th-anniversary-black-dial-st-steel-special-edition#
1067,Baroncelli Chronometer Silicon Automatic Anthracite Dial Brown Leather Strap,16.000.000,Mido,https://voila.id/collections/men/products/mido-baroncelli-chronometer-silicon-automatic-anthracite-dial-brown-leather-strap#
1068,Multifort Automatic Black Dial Tan Leather Strap,14.800.000,Mido,https://voila.id/collections/men/products/mido-multifort-automatic-black-dial-tan-leather-strap#
1069,Dorada Men Silver Dial Stainless Steel Strap,4.800.000,Mido,https://voila.id/collections/men/products/mido-dorada-men-silver-dial-stainless-steel-strap-1#
1070,Dorada Men Silver Dial Dual Tone Stainless Steel Strap,5.920.000,Mido,https://voila.id/collections/men/products/mido-dorada-men-silver-dial-dual-tone-stainless-steel-strap#
1071,Ocean Star 200C Men Automatic Grey Dial Stainless Steel Strap,15.200.000,Mido,https://voila.id/collections/men/products/mido-ocean-star-200c-men-automatic-grey-dial-stainless-steel-strap#
1072,T-Classic Bridgeport Chrono Automatic Silver Dial Brown Leather Strap,21.367.000,Tissot,https://voila.id/collections/men/products/tissot-t-classic-bridgeport-chrono-automatic-silver-dial-brown-leather-strap#
1073,All Dial Automatic Chronometer Black Dial Stainless Steel Strap,17.520.000,Mido,https://voila.id/collections/men/products/mido-all-dial-automatic-chronometer-black-dial-stainless-steel-strap#
1074,Commander Dateday Automatic Silver Dial Mesh Strap,9.840.000,Mido,https://voila.id/collections/men/products/mido-commander-dateday-automatic-silver-dial-mesh-strap#
1075,Ocean Star Captain Chronograph Black Dial Black Rubber Strap,36.465.000,Mido,https://voila.id/collections/men/products/mido-ocean-star-captain-chronograph-black-dial-black-rubber-strap#
1076,Commander II Gradient Dial Stainless Steel Strap,13.600.000,Mido,https://voila.id/collections/men/products/mido-commander-ii-gradient-dial-stainless-steel-strap#
1077,Commander II Gradient Dial Black Fabric Strap,14.320.000,Mido,https://voila.id/collections/men/products/mido-commander-ii-gradient-dial-black-fabric-strap#
1078,Multifront Automatic Silver Dial Stainless Steel Strap,11.360.000,Mido,https://voila.id/collections/men/products/mido-multifront-automatic-silver-dial-stainless-steel-strap#
1079,Commander Datoday Automatic Black Dial Stainless Steel Strap,12.720.000,Mido,https://voila.id/collections/men/products/mido-commander-datoday-automatic-black-dial-stainless-steel-strap#
1080,Multifort Automatic Grey Dial Black Leather Strap,13.200.000,Mido,https://voila.id/collections/men/products/mido-multifort-automatic-grey-dial-black-leather-strap#
1081,Baroncelli III Big Date Automatic White Dial Dual Tone Stainless Steel Strap,14.880.000,Mido,https://voila.id/collections/men/products/mido-baroncelli-iii-big-date-automatic-white-dial-dual-tone-stainless-steel-strap#
1082,Dorada Grey Dial Rose Gold Stainless Steel Strap,6.320.000,Mido,https://voila.id/collections/men/products/mido-dorada-grey-dial-rose-gold-stainless-steel-strap-1#
1083,Belluna II Royal Gent Anthracite Dial Brown Leather Strap,12.920.000,Mido,https://voila.id/collections/men/products/mido-belluna-ii-royal-gent-anthracite-dial-brown-leather-strap#
1084,Ocean Star Captain GMT Black Dial Stainless Steel Strap,17.920.000,Mido,https://voila.id/collections/men/products/mido-ocean-star-captain-gmt-black-dial-stainless-steel-strap#
1085,Baroncelli Automatic Men Silver Dial Stainless Steel Strap,10.720.000,Mido,https://voila.id/collections/men/products/mido-baroncelli-automatic-men-silver-dial-stainless-steel-strap#
1086,Divers Sixty-Five Automatic Blue Dial Black Rubber Strap,16.800.000,Oris,https://voila.id/collections/men/products/oris-divers-sixty-five-automatic-blue-dial-black-rubber-strap#
1087,Commander Datoday Automatic Silver Dial Stainless Steel Strap,12.720.000,Mido,https://voila.id/collections/men/products/mido-commander-datoday-automatic-silver-dial-stainless-steel-strap#
1088,Swiss Hunter Team PS Edition Stainless Steel Strap,21.000.000,Oris,https://voila.id/collections/men/products/oris-swiss-hunter-team-ps-edition-stainless-steel-strap#
1089,Dorada Silver Dial Stainless Steel Strap,4.800.000,Mido,https://voila.id/collections/men/products/mido-dorada-silver-dial-stainless-steel-strap#
1090,Dexter Gordon Limited Edition Grey Dial Dark Brown Leather Strap,16.800.000,Oris,https://voila.id/collections/men/products/oris-dexter-gordon-limited-edition-grey-dial-dark-brown-leather-strap#
1091,ARTIX GT DAY DATE Stainless Steel Strap,18.900.000,Oris,https://voila.id/collections/men/products/oris-artix-gt-day-date-stainless-steel-strap#
1092,Big Crown ProPilot GMT Grey Dial Dark Stainless Steel Strap,22.400.000,Oris,https://voila.id/collections/men/products/oris-big-crown-propilot-gmt-grey-dial-dark-stainless-steel-strap#
1093,Big Crown Pointer Date Dual Tone Stainless Steel Strap,16.100.000,Oris,https://voila.id/collections/men/products/oris-big-crown-pointer-date-dual-tone-stainless-steel-strap#
1094,Divers Sixty-Five Chronograph Black Dial Stainless Steel,33.600.000,Oris,https://voila.id/collections/men/products/oris-divers-sixty-five-chronograph-black-dial-stainless-steel#
1095,Aquis Date Men Black Dial Stainless Steel Strap,18.200.000,Oris,https://voila.id/collections/men/products/oris-aquis-date-men-black-dial-stainless-steel-strap#
1096,Divers Sixty-Five Silver Dial Black Rubber Strap,16.800.000,Oris,https://voila.id/collections/men/products/oris-divers-sixty-five-silver-dial-black-rubber-strap#
1097,Aquis Date Men Brown Dial Brown Leather Strap,16.800.000,Oris,https://voila.id/collections/men/products/oris-aquis-date-men-brown-dial-brown-leather-strap#
1098,Big Crown Small Second Pointer Day Silver Dial Stainless Steel Strap,18.200.000,Oris,https://voila.id/collections/men/products/oris-big-crown-small-second-pointer-day-silver-dial-stainless-steel-strap#
1099,Aquis Date Blue Dial Black Rubber Strap,16.800.000,Oris,https://voila.id/collections/men/products/oris-aquis-date-blue-dial-black-rubber-strap#
1100,Commander Chronometer Automatic Blue Dial Stainless Steel Strap,17.040.000,Mido,https://voila.id/collections/men/products/mido-commander-chronometer-automatic-blue-dial-stainless-steel-strap#
1101,Baroncelli Signature Automatic Silver Dial Stainles Steel Strap,12.320.000,Mido,https://voila.id/collections/men/products/mido-baroncelli-signature-automatic-silver-dial-stainles-steel-strap-1#
1102,Baroncelli Signature Automatic Silver Dial Dual Tone Stainles Steel Strap,17.440.000,Mido,https://voila.id/collections/men/products/mido-baroncelli-signature-automatic-silver-dial-dual-tone-stainles-steel-strap-1#
1103,Baroncelli Signature Automatic Silver Dial Dual Tone Stainles Steel Strap,14.240.000,Mido,https://voila.id/collections/men/products/mido-baroncelli-signature-automatic-silver-dial-dual-tone-stainles-steel-strap#
1104,Divers Sixty-Five Automatic Green Dial Brown Leather Strap,16.800.000,Oris,https://voila.id/collections/men/products/oris-divers-sixty-five-automatic-green-dial-brown-leather-strap#
1105,Ocean Star Tribute 75th Anniversary Brown Dial St. Steel Special Edition,14.880.000,Mido,https://voila.id/collections/men/products/mido-ocean-star-tribute-75th-anniversary-brown-dial-st-steel-special-edition#
1106,Everytime Medium Silver Dial Rose Gold Stainless Steel Strap,6.720.000,Mido,https://voila.id/collections/men/products/mido-everytime-medium-silver-dial-rose-gold-stainless-steel-strap#
1107,Baroncelli III Chronometer Cal. 80 Automatic White Dial St. Steel Strap,16.480.000,Mido,https://voila.id/collections/men/products/mido-baroncelli-iii-chronometer-cal-80-automatic-white-dial-st-steel-strap#
1108,Baroncelli II Automatic Tan Dial Dual Tone Stainless Steel Strap,19.680.000,Mido,https://voila.id/collections/men/products/mido-baroncelli-ii-automatic-tan-dial-dual-tone-stainless-steel-strap#
1109,Aquis Small Second Date Black Dial Stainless Steel Strap,22.400.000,Oris,https://voila.id/collections/men/products/oris-aquis-small-second-date-black-dial-stainless-steel-strap#
1110,Aquis GMT Date Blue Dial Stainless Steel Strap,22.400.000,Oris,https://voila.id/collections/men/products/oris-aquis-gmt-date-blue-dial-stainless-steel-strap#
1111,Big Crown Pointer Date Men Black Dial Stainless Steel Strap,18.200.000,Oris,https://voila.id/collections/men/products/oris-big-crown-pointer-date-men-black-dial-stainless-steel-strap#
1112,Big Crown Pointer Date Men Blue Dial Stainless Steel Strap,16.800.000,Oris,https://voila.id/collections/men/products/oris-big-crown-pointer-date-men-blue-dial-stainless-steel-strap#
1113,Divers Sixty-Five Momotaro Special Edition Green Dial Denim Strap,21.000.000,Oris,https://voila.id/collections/men/products/oris-divers-sixty-five-momotaro-special-edition-green-dial-denim-strap#
1114,Belluna II Automatic Black Dial Dual Tone Stainless Steel Strap,13.360.000,Mido,https://voila.id/collections/men/products/mido-belluna-ii-automatic-black-dial-dual-tone-stainless-steel-strap#
1115,Multifort Chronograph Automatic Black Dial Black Leather Strap,27.520.000,Mido,https://voila.id/collections/men/products/mido-multifort-chronograph-automatic-black-dial-black-leather-strap#
1116,Multifort Automatic Black Dial Stainless Steel Strap,15.200.000,Mido,https://voila.id/collections/men/products/mido-multifort-automatic-black-dial-stainless-steel-strap#
1117,Multifort Chronograph Black Dial Red Rubber Strap,9.120.000,Mido,https://voila.id/collections/men/products/mido-multifort-chronograph-black-dial-red-rubber-strap#
1118,Commander Big Date Black Dial Stainless Steel Strap,14.400.000,Mido,https://voila.id/collections/men/products/mido-commander-big-date-black-dial-stainless-steel-strap#
1119,Multifort III Chronometer 1 Anthracite Dial Dual Tone Stainless Steel Strap,20.910.000,Mido,https://voila.id/collections/men/products/mido-multifort-iii-chronometer-1-anthracite-dial-dual-tone-stainless-steel-strap#
1120,Dorada Gold Dial Gold Stainless Steel Strap,6.320.000,Mido,https://voila.id/collections/men/products/mido-dorada-gold-dial-gold-stainless-steel-strap#
1121,Commander Dateday Automatic Silver Dial Stainless Steel Strap,9.280.000,Mido,https://voila.id/collections/men/products/mido-commander-dateday-automatic-silver-dial-stainless-steel-strap#
1122,Divers Sixty-Five Men Black Dial Stainless Steel Strap,21.000.000,Oris,https://voila.id/collections/men/products/oris-divers-sixty-five-men-black-dial-stainless-steel-strap#
1123,Arrow On Canvas Over Tee Black,3.700.000,Off-White,https://voila.id/collections/men/products/off-white-arrow-on-canvas-over-tee-black#
1124,Degrade Arrow S/S Sli T-Shirt Black Multicolor,3.500.000,Off-White,https://voila.id/collections/men/products/off-white-degrade-arrow-s-s-sli-t-shirt-black-multicolor#
1125,VLTN Pouch Black Logo White,8.000.000,Valentino Garavani,https://voila.id/collections/men/products/valentino-garavani-vltn-pouch-black-logo-white#
1126,222 Banda Bawer Bomber Jacket Black White,2.300.000,Kappa,https://voila.id/collections/men/products/kappa-222-banda-bawer-bomber-jacket-black-white#
1127,Logo Matese Slide Sandals Black White,1.200.000,Kappa,https://voila.id/collections/men/products/kappa-logo-matese-slide-sandals-black-white#
1128,222 Banda Anniston Slim Jacket Dark Blue White Green Man,1.500.000,Kappa,https://voila.id/collections/men/products/kappa-222-banda-anniston-slim-jacket-dark-blue-white-green-man#
1129,222 Banda Rastoria Slim Long Pants Black Man,1.600.000,Kappa,https://voila.id/collections/men/products/kappa-222-banda-rastoria-slim-long-pants-black-man#
1130,Logo Sleeved T-Shirt Black Man,1.800.000,Moschino,https://voila.id/collections/men/products/moschino-logo-sleeved-t-shirt-black-man#
1131,Underwear Logo Sleeve T-Shirt Grey,1.800.000,Moschino,https://voila.id/collections/men/products/moschino-underwear-logo-sleeve-t-shirt-grey#
1132,Underwear Logo Sleeve T-Shirt Navy,1.700.000,Moschino,https://voila.id/collections/men/products/moschino-underwear-logo-sleeve-t-shirt-navy#
1133,Underwear Mini Teddy Toy T-Shirt Black Man,2.000.000,Moschino,https://voila.id/collections/men/products/moschino-underwear-mini-teddy-toy-t-shirt-black-man#
1134,Underwear Mini Teddy Toy T-Shirt Grey Man,2.000.000,Moschino,https://voila.id/collections/men/products/moschino-underwear-mini-teddy-toy-t-shirt-grey-man#
1135,Underwear Mini Teddy Toy T-Shirt Navy Man,2.000.000,Moschino,https://voila.id/collections/men/products/moschino-underwear-mini-teddy-toy-t-shirt-navy-man#
1136,Rural Cross Slim Track Jacket Army Ecru Man,3.300.000,Marcelo Burlon,https://voila.id/collections/men/products/marcelo-burlon-rural-cross-slim-track-jacket-army-ecru-man#
1137,Rural Cross Slim Track Jacket Black Blue Man,3.300.000,Marcelo Burlon,https://voila.id/collections/men/products/marcelo-burlon-rural-cross-slim-track-jacket-black-blue-man#
1138,Underwear Logo Shoulder Tape T-Shirt Black,1.800.000,Moschino,https://voila.id/collections/men/products/moschino-underwear-logo-shoulder-tape-t-shirt-black#
1139,Underwear Logo Shoulder Tape T-Shirt Grey,1.800.000,Moschino,https://voila.id/collections/men/products/moschino-underwear-logo-shoulder-tape-t-shirt-grey#
1140,Underwear Logo Tape T-Shirt Navy,1.800.000,Moschino,https://voila.id/collections/men/products/moschino-underwear-logo-tape-t-shirt-navy#
1141,Underwear Logo Band Hooded Sweatshirt Black,3.100.000,Moschino,https://voila.id/collections/men/products/moschino-underwear-logo-band-hooded-sweatshirt-black#
1142,Underwear Logo Band Hooded Sweatshirt Navy,2.800.000,Moschino,https://voila.id/collections/men/products/moschino-underwear-logo-band-hooded-sweatshirt-navy#
1143,Underwear Logo Band Hooded Jacket Black,3.100.000,Moschino,https://voila.id/collections/men/products/moschino-underwear-logo-band-hooded-jacket-black#
1144,Underwear Logo Band Hooded Jacket Grey,2.800.000,Moschino,https://voila.id/collections/men/products/moschino-underwear-logo-band-hooded-jacket-grey#
1145,Underwear Logo Band Hooded Jacket Blue,2.800.000,Moschino,https://voila.id/collections/men/products/moschino-underwear-logo-band-hooded-jacket-blue#
1146,Acrylic Arrows Printed T-Shirt White Man,3.800.000,Off-White,https://voila.id/collections/men/products/off-white-acrylic-arrows-printed-t-shirt-white-man#
1147,Caravaggio Arrow S/S Slm T-Shirt White Black,3.700.000,Off-White,https://voila.id/collections/men/products/off-white-caravaggio-arrow-s-s-slm-t-shirt-white-black#
1148,Tornado Arrow T-Shirt Black Multicolor,3.700.000,Off-White,https://voila.id/collections/men/products/off-white-tornado-arrow-t-shirt-black-multicolor#
1149,Pulse Canvas Leather Low-Cut Sneaker Black White Blue,9.000.000,Berluti,https://voila.id/collections/men/products/berluti-pulse-canvas-leather-low-cut-sneaker-black-white-blue#
1150,Kebab SS T-Shirt White,2.200.000,Aries,https://voila.id/collections/men/products/aries-kebab-ss-t-shirt-white#
1151,Dark Wash Workerwear Jeans Navy,4.200.000,Dsquared2,https://voila.id/collections/men/products/dsquared2-dark-wash-workerwear-jeans-navy#
1152,World Logo T-Shirt Black Man,2.100.000,Pharmacy Industry,https://voila.id/collections/men/products/pharmacy-industry-world-logo-t-shirt-black-man#
1153,Historical Logo T-Shirt Black Man,2.400.000,Pharmacy Industry,https://voila.id/collections/men/products/pharmacy-industry-historical-logo-t-shirt-black-man#
1154,D264 Box’ T-Shirt Black,2.700.000,Dsquared2,https://voila.id/collections/men/products/dsquared2-d264-box-t-shirt-black#
1155,Deconstructed Logo Hoodie Black Man,2.700.000,Pharmacy Industry,https://voila.id/collections/men/products/pharmacy-industry-deconstructed-logo-hoodie-black-man#
1156,D2Bros Cool T-Shirt Black,2.800.000,Dsquared2,https://voila.id/collections/men/products/dsquared2-d2bros-cool-t-shirt-black#
1157,Ceresio9 Cool T-Shirt Black,2.600.000,Dsquared2,https://voila.id/collections/men/products/dsquared2-ceresio9-cool-t-shirt-black#
1158,Shaded Cherub Cotton T-Shirt Black,4.600.000,Amiri,https://voila.id/collections/men/products/amiri-shaded-cherub-cotton-t-shirt-black#
1159,Sailor Jeans Navy,4.500.000,Dsquared2,https://voila.id/collections/men/products/dsquared2-sailor-jeans-navy#
1160,Logo Print T-Shirt Black,2.000.000,Paul & Shark,https://voila.id/collections/men/products/paul-shark-logo-print-t-shirt-black#
1161,Three-Colour Logo T-Shirt White,1.950.000,Paul & Shark,https://voila.id/collections/men/products/paul-shark-three-colour-logo-t-shirt-white#
1162,Logo Print T-Shirt Navy,2.000.000,Paul & Shark,https://voila.id/collections/men/products/paul-shark-logo-print-t-shirt-navy-1#
1163,Skater Denim Jeans Black,4.800.000,Dsquared2,https://voila.id/collections/men/products/dsquared2-skater-denim-jeans-black#
1164,Logo Print T-Shirt Navy,2.300.000,Paul & Shark,https://voila.id/collections/men/products/paul-shark-logo-print-t-shirt-navy#
1165,Mini D2 Leaf T-Shirt - Black,2.800.000,Dsquared2,https://voila.id/collections/men/products/dsquared2-mini-d2-leaf-t-shirt-black#
