no,product name,price,vendor,link
1,B Buckle Belt Black Brown,3.300.000,Bally,https://voila.id/collections/men/products/bally-belt-1#
2,Fuston Slingbag Black,5.300.000,Bally,https://voila.id/collections/men/products/bally-fuston-slingbag-black#
3,Dandelion Loafers Calfskin Black,7.500.000,Christian Louboutin,https://voila.id/collections/men/products/christian-louboutin-dandelion-loafers-calfskin-black#
4,B Buckle Belt Black Grained,3.200.000,Bally,https://voila.id/collections/men/products/bally-b-buckle-belt-black-grained#
5,VLTN Logo T-Shirt Black White Man,3.900.000,Valentino Garavani,https://voila.id/collections/men/products/valentino-garavani-vltn-green-logo-t-shirt-black-white-man#
6,VLTN Neon Mini Crossbody Bag Black,7.500.000,Valentino Garavani,https://voila.id/collections/men/products/valentino-garavani-vltn-neon-mini-crossbody-bag-black#
7,Down-Filled Bomber Jacket Black,3.600.000,Hugo Boss,https://voila.id/collections/men/products/hugo-boss-down-filled-bomber-jacket-black#
8,Vela Pattina Alabastro,13.200.000,Prada,https://voila.id/collections/men/products/prada-vela-pattina-alabastro#
9,Gray XTC Soft Luggage Black,6.900.000,Sprayground,https://voila.id/collections/men/products/sprayground-trolley#
10,Shark-Teeth Print Backpack Black,2.500.000,Sprayground,https://voila.id/collections/men/products/sprayground-shark-teeth-print-backpack-black#
11,Run Away Sneakers White Grey,18.600.000,Louis Vuitton,https://voila.id/collections/men/products/louis-vuitton-run-away-sneakers-white-grey#
12,Wetry Hoodie Yellow Man,2.300.000,Hugo Boss,https://voila.id/collections/men/products/hugo-boss-wetry-hoodie-yellow-man#
13,Tiger Embroidered Sweatshirt Dove Grey Men,3.100.000,Kenzo,https://voila.id/collections/men/products/kenzo-tiger-embroidered-sweatshirt-dove-grey-men#
14,K-Way Jacket Claude Full Zip Navy,2.900.000,Comme Des Garcons,https://voila.id/collections/men/products/comme-des-garcons-k-way-jacket-claude-full-zip-navy#
15,Chain Shark Quilted Backpack Black,2.500.000,Sprayground,https://voila.id/collections/men/products/sprayground-chain-shark-quilted-backpack-black#
16,Paddy Pro Golf Polo Shirt - Yellow,1.900.000,Hugo Boss,https://voila.id/collections/men/products/hugo-boss-paddy-pro-golf-polo-shirt-yellow#
17,Paddy Pro Golf Polo Shirt - Black,2.000.000,Hugo Boss,https://voila.id/collections/men/products/hugo-boss-paddy-pro-golf-polo-shirt-black-1#
18,Run Away Iridescent Sneakers Black,18.600.000,Louis Vuitton,https://voila.id/collections/men/products/louis-vuitton-run-away-iridescent-sneakers-black#
19,Run Away Sneakers Black,18.000.000,Louis Vuitton,https://voila.id/collections/men/products/louis-vuitton-run-away-sneakers-black#
20,Submariner Date Oystersteel,415.000.000,Rolex,https://voila.id/collections/men/products/rolex-submariner-date-oystersteel#
21,Embroidered Tiger T-Shirt White/Blue Man,2.400.000,Kenzo,https://voila.id/collections/men/products/kenzo-embroidered-tiger-t-shirt-white-blue-man#
22,Sport Oversized Monogram Jumper Black,3.800.000,Kenzo,https://voila.id/collections/men/products/kenzo-sport-oversized-monogram-jumper-black#
23,Replica Wool Sneakers White,5.100.000,Maison Margiela,https://voila.id/collections/men/products/maison-margiela-replica-wool-sneakers-white#
24,Polo Shirt Snow White Aubergine,2.200.000,Fred Perry,https://voila.id/collections/men/products/fred-perry-polo-shirt-snow-white-aubergine#
25,Mesh Low Top Sneakers White,7.500.000,Fendi,https://voila.id/collections/men/products/fendi-mesh-low-top-sneakers-white#
26,Re-Nylon Pouch Bag Black,8.000.000,Prada,https://voila.id/collections/men/products/prada-re-nylon-pouch-bag-black#
27,Saffiano Calzature Uomo,7.500.000,Prada,https://voila.id/collections/men/products/prada-saffiano-calzature-uomo#
28,Sorrento Logo Tape Slip-on Sneakers Black,5.800.000,Dolce & Gabbana,https://voila.id/collections/men/products/dolce-gabbana-sorrento-logo-tape-slip-on-sneakers-black#
29,Peter Loafers Black Men,6.000.000,Salvatore Ferragamo,https://voila.id/collections/men/products/salvatore-ferragamo-peter-loafers-black-men#
30,'Retail Therapy' Hoodie Off White Man,7.800.000,Balenciaga,https://voila.id/collections/men/products/balenciaga-retail-therapy-hoodie-off-white-man#
31,Macro Optical V Print Wool Crewneck Black,8.800.000,Valentino Garavani,https://voila.id/collections/men/products/valentino-garavani-macro-optical-v-print-wool-crewneck-black#
32,Military Logo Print Shirt Army Green,7.500.000,Alexander McQueen,https://voila.id/collections/men/products/alexander-mcqueen-military-logo-print-shirt-army-green#
33,VLTN Star Pouch Black,6.700.000,Valentino Garavani,https://voila.id/collections/men/products/valentino-garavani-vltn-star-pouch-black#
34,Tiger Embroidered Matte and Shiny Thread Sweatshirt White,3.300.000,Kenzo,https://voila.id/collections/men/products/kenzo-tiger-embroidered-matte-and-shiny-thread-sweatshirt-white#
35,Tanek_Za Metallic Logo T-Shirt Navy,1.500.000,Hugo Boss,https://voila.id/collections/men/products/hugo-boss-tanek_za-metallic-logo-t-shirt-navy#
36,Tanek_Za Metallic Logo T-Shirt Black,1.500.000,Hugo Boss,https://voila.id/collections/men/products/hugo-boss-tanek_za-metallic-logo-t-shirt-black#
37,Checkerboard Logo Intarsia-knit Jumper Men,6.900.000,Off-White,https://voila.id/collections/men/products/off-white-checkerboard-logo-intarsia-knit-jumper-men#
38,Web Interlocking G Cotton Polo Washed White,7.800.000,Gucci,https://voila.id/collections/men/products/gucci-web-interlocking-g-cotton-polo-washed-white#
39,Technical Jersey GG Track Jacket Green,16.400.000,Gucci,https://voila.id/collections/men/products/gucci-technical-jersey-gg-track-jacket-green#
40,EA7 Logo Patch Down Jacket Green,3.800.000,Emporio Armani,https://voila.id/collections/men/products/emporio-armani-ea7-logo-patch-down-jacket-green#
41,Graffiti T-Shirt Navy,3.700.000,Alexander McQueen,https://voila.id/collections/men/products/alexander-mcqueen-graffiti-t-shirt-navy#
42,Tobin_Za Polo Shirt Metallic Logo Black,2.000.000,Hugo Boss,https://voila.id/collections/men/products/hugo-boss-tobin_za-polo-shirt-metallic-logo-black#
43,Macro Optical V Cashmere Crewneck Black Ivory,9.300.000,Valentino Garavani,https://voila.id/collections/men/products/valentino-garavani-macro-optical-v-cashmere-crewneck-black-ivory#
44,Silk Embroidered Lettering Logo Polo Shirt Black,10.300.000,Prada,https://voila.id/collections/men/products/prada-silk-embroidered-lettering-logo-polo-shirt-black#
45,4G Embroidered Bermuda Shorts Black,7.300.000,Givenchy,https://voila.id/collections/men/products/givenchy-4g-embroidered-bermuda-shorts-black#
46,FF Jacquard Motif Low-Tops Sneaker Black,7.000.000,Fendi,https://voila.id/collections/men/products/fendi-ff-jacquard-motif-low-tops-sneaker-black#
47,Patent Leather Loafers Black Ghw,7.000.000,Tod's,https://voila.id/collections/men/products/tods-patent-leather-loafers-black-ghw#
48,Gancini Reversible Ornament Loafers Black Ghw,6.400.000,Salvatore Ferragamo,https://voila.id/collections/men/products/salvatore-ferragamo-gancini-reversible-ornament-loafers-black-ghw#
49,Large Tote Bag Vintage Jacquard Monogram Blue,9.700.000,MCM,https://voila.id/collections/men/products/mcm-large-tote-bag-vintage-jacquard-monogram-blue#
50,Lanyard Phone Case Color Splash Logo Leather Black,4.700.000,MCM,https://voila.id/collections/men/products/mcm-lanyard-phone-case-color-splash-logo-leather-black#
51,B23 Low Top Oblique Sneakers Orange,9.600.000,Christian Dior,https://voila.id/collections/men/products/christian-dior-b23-low-top-oblique-sneakers-orange#
52,Logo Tape T-Shirt Black,3.400.000,Alexander McQueen,https://voila.id/collections/men/products/alexander-mcqueen-logo-tape-t-shirt-black#
53,Knitwear Tartan Cashmere Sweater Men - Birch Brown,9.800.000,Burberry,https://voila.id/collections/men/products/burberry-knitwear-tartan-cashmere-sweater-men-birch-brown#
54,Paddy Pro Golf Polo Shirt - Lilac,2.000.000,Hugo Boss,https://voila.id/collections/men/products/hugo-boss-paddy-pro-golf-polo-shirt-lilac#
55,Toronto Jays T-Shirt Light Blue,3.300.000,Off-White,https://voila.id/collections/men/products/off-white-toronto-jays-t-shirt-light-blue#
56,Allover Logo Sweater Man Blue Black,11.300.000,Balenciaga,https://voila.id/collections/men/products/balenciaga-allover-logo-sweater-man-blue-black#
57,Logo Skull T-Shirt Black Multicolor,3.600.000,Alexander McQueen,https://voila.id/collections/men/products/alexander-mcqueen-logo-skull-t-shirt-black-multicolor#
58,Skull Logo T-Shirt Black White,3.400.000,Alexander McQueen,https://voila.id/collections/men/products/alexander-mcqueen-skull-logo-t-shirt-black-white#
59,Logo Skull Pocket Shirt Black White,7.900.000,Alexander McQueen,https://voila.id/collections/men/products/alexander-mcqueen-logo-skull-pocket-shirt-black-white#
60,Vieira Flat Low Top Sneakers White Navy,9.000.000,Christian Louboutin,https://voila.id/collections/men/products/christian-louboutin-vieira-flat-low-top-sneakers-white-navy#
61,Mask On Red Camo T-Shirt Off White,3.000.000,Ih Nom Uh Nit,https://voila.id/collections/men/products/ih-nom-uh-nit-mask-on-red-camo-t-shirt-off-white#
62,"""Bonbon"" T-Shirt Blue",2.600.000,Jacquemus,https://voila.id/collections/men/products/jacquemus-bonbon-t-shirt-blue#
63,Marlin V Knit Sneakers All Black,3.100.000,Veja,https://voila.id/collections/men/products/veja-marlin-v-knit-sneakers-all-black#
64,Felpa Sweatshirt Triangle Logo Embossed White,7.400.000,Prada,https://voila.id/collections/men/products/prada-felpa-sweatshirt-triangle-logo-embossed-white#
65,Ajatu Court Low Shoes Black Beige,3.300.000,Y-3,https://voila.id/collections/men/products/y-3-ajatu-court-low-shoes-black-beige#
66,Logo Spray Sweatshirt White,3.800.000,Dsquared2,https://voila.id/collections/men/products/dsquared2-logo-spray-sweatshirt-white#
67,Palm Beach Heart Sprayed T-Shirt White,3.100.000,Palm Angels,https://voila.id/collections/men/products/palm-angels-palm-beach-heart-sprayed-t-shirt-white#
68,One Stud Low-Top Nappa Sneaker - White Gold,7.000.000,Valentino Garavani,https://voila.id/collections/men/products/valentino-garavani-one-stud-low-top-nappa-sneaker-white-gold#
69,Ice Cube T-Shirt Navy,2.700.000,Jacquemus,https://voila.id/collections/men/products/jacquemus-ice-cube-t-shirt-navy#
70,Le Dentifrice Toothpaste T-Shirt White,2.700.000,Jacquemus,https://voila.id/collections/men/products/jacquemus-le-dentifrice-toothpaste-t-shirt-white#
71,Ultra 4D Sneakers Orange Bordeaux,3.400.000,Adidas,https://voila.id/collections/men/products/adidas-ultra-4d-sneakers-orange-bordeaux#
72,Ultra Boost 4.0 DNA Sneakers White,3.100.000,Adidas,https://voila.id/collections/men/products/adidas-ultra-boost-4-0-dna-sneakers-white#
73,Curved Logo Track Jacket Black White,6.100.000,Palm Angels,https://voila.id/collections/men/products/palm-angels-curved-logo-track-jacket-black-white#
74,Arrow Denim Shirt Medium Grey,6.300.000,Off-White,https://voila.id/collections/men/products/off-white-arrow-denim-shirt-medium-grey#
75,Allover Logo Round-Neck Pullover Stone White,8.300.000,Off-White,https://voila.id/collections/men/products/off-white-allover-logo-round-neck-pullover-stone-white#
76,MLB Florida Marlins T-Shirt Lake Blue,3.800.000,Off-White,https://voila.id/collections/men/products/off-white-mlb-florida-marlins-t-shirt-lake-blue#
77,Rubber Arrow Slim Hoodie Black,5.600.000,Off-White,https://voila.id/collections/men/products/off-white-rubber-arrow-slim-hoodie-black#
78,Arrows Motif Knitted Jumper Black Green,6.100.000,Off-White,https://voila.id/collections/men/products/off-white-arrows-motif-knitted-jumper-black-green#
79,MBL Oakland Athletics T-Shirt Yellow Blue,3.800.000,Off-White,https://voila.id/collections/men/products/off-white-mbl-oakland-athletics-t-shirt-yellow-blue#
80,VPC Logo-Tee Black,2.100.000,A.P.C,https://voila.id/collections/men/products/a-p-c-vpc-logo-tee-black#
81,Maceo Stripe-Knit Dark Navy,3.200.000,A.P.C,https://voila.id/collections/men/products/a-p-c-maceo-stripe-knit-dark-navy#
82,Logo Embroidered 'Rue Madame' Grey,2.900.000,A.P.C,https://voila.id/collections/men/products/a-p-c-logo-embroidered-rue-madame-grey#
83,Logo Print Sweatshirt Grey,2.900.000,A.P.C,https://voila.id/collections/men/products/a-p-c-logo-print-sweatshirt-grey#
84,Logo Print Sweatshirt Black,2.900.000,A.P.C,https://voila.id/collections/men/products/a-p-c-logo-print-sweatshirt-black#
85,Yellow Seagull Carrot Fit Raw Denim,4.100.000,Evisu,https://voila.id/collections/men/products/evisu-yellow-seagull-carrot-fit-raw-denim#
86,Off-White Seagull Carrot Fit Raw Denim,4.100.000,Evisu,https://voila.id/collections/men/products/evisu-off-white-seagull-carrot-fit-raw-denim#
87,Rhinestone Logo T-Shirt Black Multicolor,5.300.000,Vetements,https://voila.id/collections/men/products/vetements-rhinestone-logo-t-shirt-black-multicolor#
88,Think Globally Print T-Shirt Black,4.100.000,Vetements,https://voila.id/collections/men/products/vetements-think-globally-print-t-shirt-black#
89,Doodle Logo Tee Black Multi,3.400.000,Alexander McQueen,https://voila.id/collections/men/products/alexander-mcqueen-doodle-logo-tee-black-multi#
90,Zip T-Shirt White,3.600.000,Alexander McQueen,https://voila.id/collections/men/products/alexander-mcqueen-zip-t-shirt-white#
91,Logo Print Long Sleeve Shirt Black,5.100.000,Alexander McQueen,https://voila.id/collections/men/products/alexander-mcqueen-logo-print-long-sleeve-shirt-black#
92,Sneakers Leather Logo Triangle White Red,8.800.000,Prada,https://voila.id/collections/men/products/prada-sneakers-leather-logo-triangle-white-red#
93,Calzature Uomo Vitello Soft Nero,7.000.000,Prada,https://voila.id/collections/men/products/prada-calzature-uomo-vitello-soft-nero#
94,TLP Pro Pilot Set Green Dial Grey Nylon Strap,21.000.000,Oris,https://voila.id/collections/men/products/oris-tlp-pro-pilot-set-green-dial-grey-nylon-strap#
95,Essentiel U Givenchy Bumbag Black,8.200.000,Givenchy,https://voila.id/collections/men/products/givenchy-essentiel-u-givenchy-bumbag-black#
96,4G Sweater Viscose Knit Black,8.600.000,Givenchy,https://voila.id/collections/men/products/givenchy-4g-sweater-viscose-knit-black#
97,Tag Effect 4G Webbing on Shoulder T-Shirt Black,5.600.000,Givenchy,https://voila.id/collections/men/products/givenchy-tag-effect-4g-webbing-on-shoulder-t-shirt-black#
98,Tiger Logo Yellow Embroidered Sweatshirt Black Man,3.400.000,Kenzo,https://voila.id/collections/men/products/kenzo-tiger-logo-yellow-embroidered-sweatshirt-black-man#
99,Tiger Crest Merino Wool Cardigan Sapphire,3.600.000,Kenzo,https://voila.id/collections/men/products/kenzo-tiger-crest-merino-wool-cardigan-sapphire#
100,Tiger Crest Wool Cardigan Blue Black,4.600.000,Kenzo,https://voila.id/collections/men/products/kenzo-tiger-crest-wool-cardigan-blue-black#
101,Classic Interecciato Crossbody Bag Black,19.500.000,Bottega Veneta,https://voila.id/collections/men/products/bottega-veneta-classic-interecciato-crossbody-bag-black#
102,Oversized Cable Knit Cardigan Black Red,10.800.000,Gucci,https://voila.id/collections/men/products/gucci-oversized-cable-knit-cardigan-black-red#
103,Jersey Sweatshirt Gucci Mirror Print Black,11.800.000,Gucci,https://voila.id/collections/men/products/gucci-jersey-sweatshirt-gucci-mirror-print-black#
104,GG Supreme G Interlocking Crossbody Bag Black,14.400.000,Gucci,https://voila.id/collections/men/products/gucci-gg-supreme-g-interlocking-crossbody-bag-black#
105,Interlocking G Loafers Black,9.800.000,Gucci,https://voila.id/collections/men/products/gucci-interlocking-g-loafers-black#
106,All Over Logo Sweater Camel Light Grey,8.200.000,Vetements,https://voila.id/collections/men/products/vetements-all-over-logo-sweater-camel-light-grey#
107,Men's Track Trainers White/Black,11.000.000,Balenciaga,https://voila.id/collections/men/products/balenciaga-mens-track-trainers-white-black#
108,Triple S Clear Sole Sneakers White Black Transparent,11.400.000,Balenciaga,https://voila.id/collections/men/products/balenciaga-triple-s-clear-sole-sneakers-white-black-transparent#
109,Triple S Trainer Beige Men,11.000.000,Balenciaga,https://voila.id/collections/men/products/balenciaga-triple-s-trainer-beige-men#
110,Speed Trainers Soccers Knit Black Man,9.500.000,Balenciaga,https://voila.id/collections/men/products/balenciaga-speed-trainers-soccers-knit-black-man#
111,B25 Low-Top Sneaker Black,9.800.000,Christian Dior,https://voila.id/collections/men/products/christian-dior-b25-low-top-sneaker-black#
112,B27 Low Top Sneaker Black,17.000.000,Christian Dior,https://voila.id/collections/men/products/christian-dior-b27-low-top-sneaker-black#
113,B27 Low Top Sneaker Grey,17.000.000,Christian Dior,https://voila.id/collections/men/products/christian-dior-b27-low-top-sneaker-grey#
114,VLTN Canvas Espadrilles Black,5.200.000,Valentino Garavani,https://voila.id/collections/men/products/valentino-garavani-vltn-canvas-espadrilles-black#
115,Camouflage Noir Rockrunner Sneaker Black,6.300.000,Valentino Garavani,https://voila.id/collections/men/products/valentino-garavani-camouflage-noir-rockrunner-sneaker-black#
116,VLTN Logo Print Shirt White Red,7.600.000,Valentino Garavani,https://voila.id/collections/men/products/valentino-garavani-vltn-logo-print-shirt-white-red#
117,Logo Print T-Shirt White/Black,4.400.000,Valentino Garavani,https://voila.id/collections/men/products/valentino-garavani-logo-print-t-shirt-white-black#
118,Logo Print T-Shirt Black/Camel,4.400.000,Valentino Garavani,https://voila.id/collections/men/products/valentino-garavani-logo-print-t-shirt-black-camel#
119,550 White/Red- Man,3.000.000,New Balance,https://voila.id/collections/men/products/new-balance-550-white-red-man#
120,1 Mid Sonics - Man,3.400.000,Air Jordan,https://voila.id/collections/men/products/air-jordan-1-mid-sonics-man#
121,Air Force 1 Athletic Club Black University Gold - Man,2.700.000,Nike,https://voila.id/collections/men/products/nike-air-force-1-athletic-club-black-university-gold-man#
122,"""Somewhere in The Aape Universe"" Sweatshirt Black Yellow",2.400.000,AAPE BY BATHING APE,https://voila.id/collections/men/products/aape-by-bathing-ape-somewhere-in-the-aape-universe-sweatshirt-black-yellow#
123,Camou Logo and Slogan T-Shirt Black,1.900.000,AAPE BY BATHING APE,https://voila.id/collections/men/products/aape-by-bathing-ape-camou-logo-and-slogan-t-shirt-black#
124,Camou Logo T-Shirt Black,1.900.000,AAPE BY BATHING APE,https://voila.id/collections/men/products/aape-by-bathing-ape-camou-logo-t-shirt-black#
125,Logo Sleeve Sweatshirt Khaki,2.400.000,AAPE BY BATHING APE,https://voila.id/collections/men/products/aape-by-bathing-ape-logo-sleeve-sweatshirt-khaki#
126,Logo Sleeve Sweatshirt Black,2.400.000,AAPE BY BATHING APE,https://voila.id/collections/men/products/aape-by-bathing-ape-logo-sleeve-sweatshirt-black#
127,Camou Reversible T-Shirt Khaki,2.200.000,AAPE BY BATHING APE,https://voila.id/collections/men/products/aape-by-bathing-ape-camou-reversible-t-shirt-khaki#
128,Beverly Hills Sneaker Black White Brown,17.800.000,Louis Vuitton,https://voila.id/collections/men/products/louis-vuitton-beverly-hills-sneaker-black-white-brown#
129,Rivoli Sneaker Monogram Metallic Canvas Black,18.500.000,Louis Vuitton,https://voila.id/collections/men/products/louis-vuitton-rivoli-sneaker-monogram-metallic-canvas-black#
130,Logo Intarsia Sweater Black,10.300.000,Prada,https://voila.id/collections/men/products/prada-logo-intarsia-sweater-black#
131,Printed Cotton T-Shirt White,6.300.000,Prada,https://voila.id/collections/men/products/prada-printed-cotton-t-shirt-white#
132,Re-nylon Saffiano Smartphone Case Beige,8.000.000,Prada,https://voila.id/collections/men/products/prada-re-nylon-saffiano-smartphone-case-beige#
133,Macro Re-Nylon Brushed Leather Sneakers White,7.800.000,Prada,https://voila.id/collections/men/products/prada-macro-re-nylon-brushed-leather-sneakers-white#
134,District Leather Sneakers White Black,8.600.000,Prada,https://voila.id/collections/men/products/prada-district-leather-sneakers-white-black-2#
135,V Logo Key Chain Shw,3.900.000,Valentino Garavani,https://voila.id/collections/men/products/valentino-garavani-v-logo-key-chain-shw#
136,Seavaste 2 Orlato Sneakers Black,8.800.000,Christian Louboutin,https://voila.id/collections/men/products/christian-louboutin-seavaste-2-orlato-sneakers-black#
137,Mixed Materials Space Sneakers - Black Argento,8.300.000,Dolce & Gabbana,https://voila.id/collections/men/products/dolce-gabbana-mixed-materials-space-sneakers-black-argento#
138,Industrial Sandal Slide Logo Black,3.100.000,Off-White,https://voila.id/collections/men/products/off-white-industrial-sandal-slide-logo-black#
139,Logo Neon Univers Print Nylon Bumber Navy,15.600.000,Valentino Garavani,https://voila.id/collections/men/products/valentino-garavani-logo-neon-univers-print-nylon-bumber-navy#
140,Goyardine Victoire Wallet Brown,14.000.000,Goyard,https://voila.id/collections/men/products/goyard-goyardine-victoire-wallet-brown#
141,College Sweatshirt Black,11.300.000,Balenciaga,https://voila.id/collections/men/products/balenciaga-college-sweatshirt-black#
142,Men'S Track Clear Sole Trainers Grey Man,11.500.000,Balenciaga,https://voila.id/collections/men/products/balenciaga-mens-track-clear-sole-trainers-grey-man#
143,Speed 2.0 Sneakers Navy,11.000.000,Balenciaga,https://voila.id/collections/men/products/balenciaga-speed-2-0-sneakers-navy#
144,Paule 4 Polo Shirt - Grey Logo Purple,2.000.000,Hugo Boss,https://voila.id/collections/men/products/hugo-boss-paule-4-polo-shirt-grey-logo-purple#
145,Paule 4 Polo Shirt Dark Navy,1.900.000,Hugo Boss,https://voila.id/collections/men/products/hugo-boss-paule-4-polo-shirt-dark-navy#
146,Paddy Pro Golf Polo Shirt Purple,2.000.000,Hugo Boss,https://voila.id/collections/men/products/hugo-boss-paddy-pro-golf-polo-shirt-purple#
147,Paddy Pro Golf Polo Shirt - Navy,2.100.000,Hugo Boss,https://voila.id/collections/men/products/hugo-boss-paddy-pro-golf-polo-shirt-navy#
148,Polo Paul Curved Slim Fit Open - Dark Grey Krah Yellow,2.000.000,Hugo Boss,https://voila.id/collections/men/products/hugo-boss-polo-paul-curved-slim-fit-open-dark-grey-krah-yellow#
149,Bio-Based Check Crossbody Bag Dark Birch Brown,9.200.000,Burberry,https://voila.id/collections/men/products/burberry-bio-based-check-crossbody-bag-dark-birch-brown#
150,Globe Graphic Sweatshirt Black,6.900.000,Burberry,https://voila.id/collections/men/products/burberry-globe-graphic-sweatshirt-black#
151,Monogram Motif Short-Sleeve Shirt White Man,4.400.000,Burberry,https://voila.id/collections/men/products/burberry-monogram-motif-short-sleeve-shirt-white-man#
152,Monogram Motif Piqué Polo Shirt Navy,3.900.000,Burberry,https://voila.id/collections/men/products/burberry-monogram-motif-pique-polo-shirt-navy#
153,4G Texture Jacquard Sweater Grey,8.600.000,Givenchy,https://voila.id/collections/men/products/givenchy-4g-texture-jacquard-sweater-grey#
154,Webbing Leather Sneakers Black,5.800.000,Givenchy,https://voila.id/collections/men/products/givenchy-webbing-leather-sneakers-black#
155,City 4G Jacquard Sneaker White,6.500.000,Givenchy,https://voila.id/collections/men/products/givenchy-city-4g-jacquard-sneaker-white#
156,Pullover Wool Jumper Brown,7.600.000,Fendi,https://voila.id/collections/men/products/fendi-pullover-wool-jumper-brown#
157,Monogram Pattern Stripe Zip-Up Sweater White,10.600.000,Fendi,https://voila.id/collections/men/products/fendi-monogram-pattern-stripe-zip-up-sweater-white#
158,Monogram Pattern Stripe Zip-Up Sweater Black,10.600.000,Fendi,https://voila.id/collections/men/products/fendi-monogram-pattern-stripe-zip-up-sweater-black#
159,Jabil Sandals Black Red,4.300.000,Bally,https://voila.id/collections/men/products/bally-jabil-sandals-black-red#
160,Jabil Sandals Black White,4.300.000,Bally,https://voila.id/collections/men/products/bally-jabil-sandals-black-white#
161,Curved Logo V-Neck Jumper Navy,3.800.000,Palm Angels,https://voila.id/collections/men/products/palm-angels-curved-logo-v-neck-jumper-navy#
162,Persian Fantasy Arrow Sweater Grey,7.900.000,Off-White,https://voila.id/collections/men/products/off-white-persian-fantasy-arrow-sweater-grey#
163,Degrade Arrows Sweatshirt White Yellow Multi Man,4.800.000,Off-White,https://voila.id/collections/men/products/off-white-degrade-arrows-sweatshirt-white-yellow-multi-man#
164,Citypouch Rockstud Black,8.500.000,Christian Louboutin,https://voila.id/collections/men/products/christian-louboutin-citypouch-rockstud-black#
165,Our Georges B Loafers Patent Black,9.800.000,Christian Louboutin,https://voila.id/collections/men/products/christian-louboutin-our-georges-b-loafers-patent-black#
166,Vida Viva LT Sneakers Loubi Black,8.300.000,Christian Louboutin,https://voila.id/collections/men/products/christian-louboutin-vida-viva-lt-sneakers-loubi-black#
167,Vintage Check Cotton Sneakers Archive Beige,6.000.000,Burberry,https://voila.id/collections/men/products/burberry-vintage-check-cotton-sneakers-archive-beige-1#
168,Vintage Check Cotton Sneakers Birch Brown,6.000.000,Burberry,https://voila.id/collections/men/products/burberry-vintage-check-cotton-sneakers-birch-brown#
169,Lou Spikes Orlato Calf Sneakers White,8.800.000,Christian Louboutin,https://voila.id/collections/men/products/christian-louboutin-lou-spikes-orlato-calf-sneakers-white#
170,Milou Loafer Black,8.500.000,Christian Louboutin,https://voila.id/collections/men/products/christian-louboutin-milou-loafer-black#
171,Roller-Boat Flat Crosta Fiesta GG-Multi Gun Metal,10.500.000,Christian Louboutin,https://voila.id/collections/men/products/christian-louboutin-roller-boat-flat-crosta-fiesta-gg-multi-gun-metal#
172,Trippy Box T-Shirt White,2.300.000,Domrebel,https://voila.id/collections/men/products/domrebel-trippy-box-t-shirt-white#
173,Trippy Box T-Shirt Black,2.300.000,Domrebel,https://voila.id/collections/men/products/domrebel-trippy-box-t-shirt-black#
174,Storm Box T-Shirt Black,2.300.000,Domrebel,https://voila.id/collections/men/products/domrebel-storm-box-t-shirt-black#
